Province,Town,Email,Phone,Website,Website1,Gender,Language,Curriculum,GradeMin,GradeMax,OpeningHours,Description,Address
Kwazulu Natal,Kokstad,rivermeadca@gmail.com,,,https://saprivateschools.co.za/listing/rivermead-christian-primary-school/,Tourism,Economics,Visual Arts,Consumer Studies,Agricultural technology,7:00 am - 3:00 pm,"The vision of Rivermead Christian Academy is to be planting and watering truth in children for an eternal harvest, based on 1 Corinthians 3:6. The Mission of the School is to establish a Christian School as a ministry of the First Baptist Church, Kokstad, and for the Kokstad community. Our one chief goal is to reach children with the gospel. Our desire is to minister to all children and their parents and to be a positive impact in our community. Rivermead Christian Academy does not seek to be fancy or elite, rather, we want to be able to accept every child who applies here, regardless of socio-economic background. 54 St Johns St, Kokstad, 4700, South AfricaMonday7:00 am - 3:00 pmTuesday7:00 am - 3:00 pmWednesday7:00 am - 3:00 pmThursday7:00 am - 3:00 pmFriday7:00 am - 3:00 pmSaturdayClosedSundayClosed
							November 8, 2024 10:41 am local time","54 St Johns St, Kokstad, 4700, South Africa"
North West,Klerksdorp,admin@kingstonacademy.co.za,,,https://saprivateschools.co.za/listing/kingston-academy-primary-school/,Accounting,Music,African Languages,Tourism,Economics,7:00 am - 3:00 pm,"The Kingston Academy is an outstanding secondary school, located in North Kingston not far from the River Thames.  The school was set up by the Kingston Educational Trust, a partnership between Kingston University, Kingston College and Royal Borough of Kingston.  Having opened our doors for the first time in 2015 we are now in our sixth year of operation with pupils in Years 7, 8, 9, 10, 11 and Sixth Form. We reached our capacity last year, in September 2021.  The school has developed87 Vorster Ave, Glenanda, 2091, South AfricaMonday7:00 am - 3:00 pmTuesday7:00 am - 3:00 pmWednesday7:00 am - 3:00 pmThursday7:00 am - 3:00 pmFriday7:00 am - 3:00 pmSaturdayClosedSundayClosed
							November 8, 2024 10:41 am local time","87 Vorster Ave, Glenanda, 2091, South Africa"
Alberton,Gauteng,info@littlebambinos.co.za,,,https://saprivateschools.co.za/listing/little-bambinos-pre-school/,CAPS,,Alberton,Grade RR,Grade R,7:00 am - 3:00 pm,"At Little Bambinos we understand that raising a child in today's busy world is no easy task. We can help by supporting your child's learning and well-being during these important early years. Research shows that children learn most successfully when families and educators work together. So, we want to get to know you and your family, and we want you to get to know us well too.Cnr Albany, 12 Penzance St, Alberton, Johannesburg, 1449, South AfricaMonday7:00 am - 3:00 pmTuesday7:00 am - 3:00 pmWednesday7:00 am - 3:00 pmThursday7:00 am - 3:00 pmFriday7:00 am - 3:00 pmSaturdayClosedSundayClosed
							November 8, 2024 10:41 am local time","Cnr Albany, 12 Penzance St, Alberton, Johannesburg, 1449, South Africa"
Western Cape,Winelands,lifestylecw@gmail.com,,,https://saprivateschools.co.za/listing/lifestyle-christian-academy-primary-school/,IEB,,Western Cape,Facebook,Twitter,7:00 am - 3:00 pm,"The Accelerated Christian Education curriculum assures parents of: A solid, internationally recognised education. Development of locally relevant curriculum and compliance with the South African National Curriculum Requirements. A course of study diagnostically individualised to meet your child's specific needs and learning capability. Gifted students are motivated and weaker students are not left behind. A curriculum that assists learners in setting their own goals and prepares them to manage multiple projects, objectives and deadlines with ease. A programme that not only imparts knowledge and understanding but incorporates character-building and wisdom principles. The chief distinction of this curriculum is its focus on WISDOM as a critical part of the learning process. To be a success, the student must learn not only how to earn a living but how to live!Lifestyle Christian Academy, Worcester Central, Worcester, South Africa, South AfricaMonday7:00 am - 3:00 pmTuesday7:00 am - 3:00 pmWednesday7:00 am - 3:00 pmThursday7:00 am - 3:00 pmFriday7:00 am - 3:00 pmSaturdayClosedSundayClosed
							November 8, 2024 10:41 am local time","Lifestyle Christian Academy, Worcester Central, Worcester, South Africa, South Africa"
Gauteng,Sandton,hello@thegreenschool.co.za,,,https://saprivateschools.co.za/listing/the-green-primary-school/,IEB,,Gauteng,Facebook,Twitter,7:00 am - 3:00 pm,"The Green School educates students from around the world, ranging in age between 3 and 14 years and instructed by both locally and internationally trained educators. The school has adopted a flexible model of teaching and learning with students in Middle and High School (opening 2022) working both on campus and online. The school has an average class size of 15 students with a student-teacher ratio of 9:1. 258 B Cedar Road, 6th Road Chartwell, North Champagne Estate, Johannesburg, 2121, South AfricaMonday7:00 am - 3:00 pmTuesday7:00 am - 3:00 pmWednesday7:00 am - 3:00 pmThursday7:00 am - 3:00 pmFriday7:00 am - 3:00 pmSaturdayClosedSundayClosed
							November 8, 2024 10:41 am local time","258 B Cedar Road, 6th Road Chartwell, North Champagne Estate, Johannesburg, 2121, South Africa"
Western Cape,South Peninsula,info@therockacademy.co.za,,,https://saprivateschools.co.za/listing/the-rock-academy-high-school/,IEB,,Western Cape,Facebook,Twitter,7:00 am - 3:00 pm,"We are a Christian School situated in the lovely town of Fish Hoek on the Cape Peninsula. At The Rock Academy we believe in the expression that ""today our children live in our world, tomorrow we live in theirs."" With this in mind we want to partner with our parents to provide our students with an excellent education that is God honouring. We do this in order to fulfill the directive of the word of God to ""Train up a child in the way he should go."" We have a Christian based curriculum that reinforces Godly character, and holds firm to the Christian world view. Sunnydale Rd, Sunnydale, Cape Town, 7975, South AfricaMonday7:00 am - 3:00 pmTuesday7:00 am - 3:00 pmWednesday7:00 am - 3:00 pmThursday7:00 am - 3:00 pmFriday7:00 am - 3:00 pmSaturdayClosedSundayClosed
							November 8, 2024 10:41 am local time","Sunnydale Rd, Sunnydale, Cape Town, 7975, South Africa"
Kwazulu Natal,North Coast,sholann@havenofrest.org.za,,,https://saprivateschools.co.za/listing/the-haven-academy-pre-school/,CAPS,,Kwazulu Natal,Grade RR,Grade R,7:00 am - 3:00 pm,"The primary objective of the HOR is to be a beacon of hope to the homeless, destitute, and the down trodden of society, by providing essential services to all people irrespective of race, colour, creed or religion of this disenfranchised community.HOR was founded in 2000 by visionaries Dr. Ronnie & Pastor Shirley Naidoo, who were inspired to establish an institution that would cater for the social development, enhancement and welfare of the community. The primary objective of the HOR is to be a beacon of hope to the homeless, destitute, and the down trodden of society, by providing essential services to all people irrespective of race, colour, creed or religion of this disenfranchised community.83 Hospital Hill Rd, Mitchell Village, Westbrook, 4399, South AfricaMonday7:00 am - 3:00 pmTuesday7:00 am - 3:00 pmWednesday7:00 am - 3:00 pmThursday7:00 am - 3:00 pmFriday7:00 am - 3:00 pmSaturdayClosedSundayClosed
							November 8, 2024 10:41 am local time","83 Hospital Hill Rd, Mitchell Village, Westbrook, 4399, South Africa"
Eastern Cape,Grahamstown,admissions@dsgschool.com,0466034300,https://dsgschool.com/,https://saprivateschools.co.za/listing/diocesan-school-for-girls-grahamstown-grade-8-12/,Equestrian,Fitness & P.E,Golf,Soccer,Swimming,,"At the Diocesan School for Girls, we are passionate about empowering girls with the
competencies and character they may require to achieve their dreams and contribute to their local and global communities as 21st century women.
We prioritise staying abreast of the latest research on innovative education, but we also draw on the practical wisdom gained from a century and a half of institutional experience. DSG provides a safe, inclusive environment where girls can fearlessly
follow their curiosity and learn through discovery and critical thinking and even risk failure with no judgement and only learning as a consequence.
Therefore, we encourage girls to explore the full range of opportunities in academics, sports, the arts, culture, the outdoors, community engagement, travel and leadership.
Our classrooms, stages, sports fields, boarding houses, Chapel and The Monastery outdoor centre are among the vibrant spaces where highly qualified staff work tirelessly to bring out the best in every individual.Here the girls learn about the value of hard work, perseverance, collaboration, sustainability, social justice and delayed gratification.There is something magical about the lifestyle on the DSG campus, probably thanks to the historic architecture, leafy gardens and peaceful smalltown landscape surrounding it. Full-time boarding enables DSG girls to be astonishingly productive and fully immersed in school life. They learn to appreciate the rich diversity of their peers, which
builds resilience and strengthens values of respect, humility, compassion and friendship. Such a busy school life can take its toll and girls are therefore monitored and supported by a Wellness Team that includes the resident pastoral staff in every house,
Chaplain, San sisters, educational psychologist and biokineticist.
We are proud to be custodians of our unique heritage while extending the legacy of the DSG through inclusive, future-minded education, in keeping with our motto ‘En Avant!’.DSG Junior - Grade 4-7DSG Senior - Grade 8-12Worcester St, Grahamstown, Makhanda, 6139, South AfricaMonday7:00 am - 4:30 pmTuesdayN/AWednesdayN/AThursdayN/AFridayN/ASaturdayN/ASundayN/A
							November 8, 2024 12:41 pm local time","Worcester St, Grahamstown, Makhanda, 6139, South Africa"
Queensburgh,Kwazulu Natal,qca@saol.com,,,https://saprivateschools.co.za/listing/queensburgh-christian-acadamy-pre-school/,CAPS,,Queensburgh,Grade RR,Grade R,7:00 am - 3:00 pm,"At Queensburgh Christian Acadamy we believe in education without fear, where good citizenship, leadership and sportsmanship are developed by placing emphasis on the needs of every child. We would like to welcome you to the growing community of families that believe in the value of a QCA education. QCA graduates are well rounded, confident and apply the education and life skills with which they have been equipped.Queensburgh Christian Academy, Hillary, Durban, South Africa, South AfricaMonday7:00 am - 3:00 pmTuesday7:00 am - 3:00 pmWednesday7:00 am - 3:00 pmThursday7:00 am - 3:00 pmFriday7:00 am - 3:00 pmSaturdayClosedSundayClosed
							November 8, 2024 10:41 am local time","Queensburgh Christian Academy, Hillary, Durban, South Africa, South Africa"
Cape Town,,marketing@bishops.org.za,+27 (0)21 659 1000,,https://saprivateschools.co.za/listing/bishops-diocesan-college/,English,CAPS,,YouTube,Copy link,7:00 am - 3:00 pm,"Bishops, Cape Town, a South African school, aspires to: live the Christian faith in the Anglican tradition, humbly and courageously respect, nurture and value each person inspire individuals to open their minds and hearts, and to reach their dreams offer a world-class, all-round education fully up to date with the best educational and technological advances address global issues including the sustainability of the environment both as part of the curriculum and as demonstrated in school operations embrace and celebrate diversity in the communities of our school and nation. Pre-Prep was founded in 1962 with 24 boys. It consisted of two classrooms, a staff room, kitchen and a cloakroom. The school now consists of three Grade R classrooms and playground with a small staff room and kitchen, three Grade 1 classrooms and three Grade 2 classrooms. There is a small hall and offices with a staff room. Both Grade 1 and Grade 2 have their own play area with climbing apparatus. As we are on the College campus, the boys are also able to make use of the sports field beside the school.65 Campground Rd, Rondebosch, Cape Town, 7700, South AfricaMonday7:00 am - 3:00 pmTuesday7:00 am - 3:00 pmWednesday7:00 am - 3:00 pmThursday7:00 am - 3:00 pmFriday7:00 am - 3:00 pmSaturdayClosedSundayClosed
							November 8, 2024 10:41 am local time","65 Campground Rd, Rondebosch, Cape Town, 7700, South Africa"
Gauteng,Jhb South,info@tmsca.net,,,https://saprivateschools.co.za/listing/mustard-seed-christian-academy-pre-school/,CAPS,,Gauteng,Grade RR,Grade R,7:00 am - 3:00 pm,"A Vibrant Learning Environment The School was established in the 1960's and has always been an establishment for education. Over the years The Mustard Seed Christian Academy Pre and Primary School was born from a vision to reach children with the Gospel thereby transforming lives spiritually, socially and culturally and providing learners with an educational base that is biblical and committed to the content of covenant life with God. Ã¯Â»Â¿Child Safety All parents and designated persons are required to sign learners in and out of school. The school is situated on a well secured property. Staff members are certified with level one first aid. Ã¯Â»Â¿Our Staff We are dedicated and enthusiastic when it comes to teaching children to be good citizens' of their Nation and learning for their future. We are passionate to teach the learners how to live with Godly principles on a daily bases. We endeavour to build relationships with the parent, teacher, and child with a view on the importance of family.The Mustard Seed Christian Academy, Benray Road, Reuven, Johannesburg, South Africa, South AfricaMonday7:00 am - 3:00 pmTuesday7:00 am - 3:00 pmWednesday7:00 am - 3:00 pmThursday7:00 am - 3:00 pmFriday7:00 am - 3:00 pmSaturdayClosedSundayClosed
							November 8, 2024 10:41 am local time","The Mustard Seed Christian Academy, Benray Road, Reuven, Johannesburg, South Africa, South Africa"
Gauteng,Jhb East,fhadmissions@pinnaclecolleges.co.za,,,https://saprivateschools.co.za/listing/pinnacle-pre-school/,IEB,,Gauteng,Grade RR,Grade R,7:00 am - 3:00 pm,"Pinnacle Colleges is well placed as a Community Centered school group. Our schools offer a progressive (relationship based) well-resourced classroom product which is complimented by a reasonable extra-mural offering relevant to the area and competitor schools. Schools within the group will be well-positioned within the needs of the community.39 Pinelands Road, Founders Hill, Lethabong, 1609, South AfricaMonday7:00 am - 3:00 pmTuesday7:00 am - 3:00 pmWednesday7:00 am - 3:00 pmThursday7:00 am - 3:00 pmFriday7:00 am - 3:00 pmSaturdayClosedSundayClosed
							November 8, 2024 10:42 am local time","39 Pinelands Road, Founders Hill, Lethabong, 1609, South Africa"
Gauteng,Pretoria Central,registrations@royalschools.co.za,+27 (0) 12 324 1069,https://www.royalschools.co.za/queens-private-schools-pretoria.html,https://saprivateschools.co.za/listing/royal-high-schools-queens-private/,Co-Ed (Mixed),English,CAPS,,Pretoria West,7:00 am - 3:00 pm,"In 1993 the Fourie family started one of the first affordable private schools in South Africa. In many cases learners had limited opportunities to receive quality education. With an engrained passion for education, and the support of dedicated and loyal people, the Fouries have managed to establish and grow a successful organisation over the last 28 years.310 WF Nkomo St, Pretoria West, Pretoria, 0001, South AfricaMonday7:00 am - 3:00 pmTuesday7:00 am - 3:00 pmWednesday7:00 am - 3:00 pmThursday7:00 am - 3:00 pmFriday7:00 am - 3:00 pmSaturdayClosedSundayClosed
							November 8, 2024 10:42 am local time","310 WF Nkomo St, Pretoria West, Pretoria, 0001, South Africa"
Western Cape,South Peninsula,admissions@imhoffwaldorf.org,,,https://saprivateschools.co.za/listing/imhoff-waldorf-primary-school/,Computer Applications Technology (CAT),Engineering Graphics and Design,Electrical Technology,Life Sciences,Mathematical Literacy,7:00 am - 3:00 pm,"Imhoff Waldorf School is an independent community-orientated school offering holistic and creative Waldorf education to children from the South Peninsula. We are the only Waldorf School in the South Peninsula. Our school is situated amongst the trees in proximity to an animal farm, providing a unique rural experience not often found within our present urban environment. We are completely powered by solar and wind power. Our school has a Parent & Child Circle, Toddler Group, Playgroup, Kindergarten, and a Primary School from Class 1 to Class 7. Slangkop Road, Ocean View, Cape Town, 7975, South Africa, South AfricaMonday7:00 am - 3:00 pmTuesday7:00 am - 3:00 pmWednesday7:00 am - 3:00 pmThursday7:00 am - 3:00 pmFriday7:00 am - 3:00 pmSaturdayClosedSundayClosed
							November 8, 2024 10:42 am local time","Slangkop Road, Ocean View, Cape Town, 7975, South Africa, South Africa"
Gauteng,Randburg,info@minalopato.co.za,,,https://saprivateschools.co.za/listing/mina-lopato-pre-school/,CAPS,,Gauteng,Grade RR,Grade R,7:00 am - 3:00 pm,"Mina Lopato celebrates diversity, curiosity, and kindness with deep South African roots and a Jewish soul. Mina Lopato Nursery School has proudly served the communities in and around Greenside since 1961. Founded on Jewish values, we continue to create an environment that feels like home but also encourages children to seek out a greater understanding of the world beyond. We believe true education goes beyond academics to embrace all kinds of learning--and all kinds of learners. In 2016, Mina Lopato moved into the spacious hall of the Greenside Synagogue. All five classes lead into a massive, sunny indoor play area that houses a custom-designed ""Geppetto's World"" play area and a state-of-the-art (and still delightfully classic) library. Outside, our beautiful gardens and thoughtfully designed play areas give learning a welcome breath of fresh air. Mina Lopato Nursery School and Greenside Synagogue enjoy a mutually beneficial relationship and celebrate all Jewish holidays under the spiritual guidance of Rabbi Mendel Rabinowitz and Adina Roth. See Randburg area on map to see other schools nearby.Mina Lopato Nursery School, Chester Road, Greenside East, Johannesburg, South Africa, South AfricaMonday7:00 am - 3:00 pmTuesday7:00 am - 3:00 pmWednesday7:00 am - 3:00 pmThursday7:00 am - 3:00 pmFriday7:00 am - 3:00 pmSaturdayClosedSundayClosed
							November 8, 2024 10:42 am local time","Mina Lopato Nursery School, Chester Road, Greenside East, Johannesburg, South Africa, South Africa"
Bela Bela,Limpopo,info@academia.org.za,,,https://saprivateschools.co.za/listing/academia-private-primary-school-and-kiddies-academy/,Mechanical Technology,Information Technology,English,Music,African Languages,7:00 am - 3:00 pm,"Academia Private School was established in January 2001, We are located in a Bushveld town, Bela Bela, close to Pretoria. We are a Cambridge International Curriculum focused Academic school. Learners can complete their AS Levels at Academia Private School. We provide a safe, friendly and disciplined learning environment.24 Ludorf St, Bela-Bela, 0480, South AfricaMonday7:00 am - 3:00 pmTuesday7:00 am - 3:00 pmWednesday7:00 am - 3:00 pmThursday7:00 am - 3:00 pmFriday7:00 am - 3:00 pmSaturdayClosedSundayClosed
							November 8, 2024 10:42 am local time","24 Ludorf St, Bela-Bela, 0480, South Africa"
Kwazulu Natal,South Coast,tinytotspp@telkomsa.net,,,https://saprivateschools.co.za/listing/tiny-tots-pre-pre-school/,CAPS,,Kwazulu Natal,Grade RR,Grade R,7:00 am - 3:00 pm,"This school's description is currently being updated and will appear within the near future.176 Blamey Rd, Woodridge Estate, Montclair., South AfricaMonday7:00 am - 3:00 pmTuesday7:00 am - 3:00 pmWednesday7:00 am - 3:00 pmThursday7:00 am - 3:00 pmFriday7:00 am - 3:00 pmSaturdayClosedSundayClosed
							November 8, 2024 10:42 am local time","176 Blamey Rd, Woodridge Estate, Montclair., South Africa"
Kwazulu Natal,Dundee,ichthus@trustnet.co.za,,,https://saprivateschools.co.za/listing/ichthus-christian-primary-school/,Computer Applications Technology (CAT),Engineering Graphics and Design,Electrical Technology,Life Sciences,Mathematical Literacy,7:00 am - 3:00 pm,"We offer small classes, limited at 15 learners per class, from Grade RR to 7.Our aim is to provide academic excellence by well-trained teachers who are appointed by the Governing Body. Grade RR & R learners get the opportunity learn ball-skills and great motor development. We provide swimming lessons for Grade R learners as part of the school fees. At the beginning of 2016 we introduced the GymKid programme. A trained gymnastics instructor travels to Dundee to present this programme. 28 Hosking St, Dundee, 3000, South AfricaMonday7:00 am - 3:00 pmTuesday7:00 am - 3:00 pmWednesday7:00 am - 3:00 pmThursday7:00 am - 3:00 pmFriday7:00 am - 3:00 pmSaturdayClosedSundayClosed
							November 8, 2024 10:42 am local time","28 Hosking St, Dundee, 3000, South Africa"
,,,,,,,,,,,,,
Kwazulu Natal,Pietermaritzburg,bcacademy@telkomsa.net,,,https://saprivateschools.co.za/listing/bethel-christian-academy-primary-school/,English,Life Sciences,Mathematical Literacy,Physical Sciences,Afrikaans,7:00 am - 3:00 pm,"Bethel Christian Academy Was established in 1993, We a proudly christian school striving to give our students the perfect foundation . We use the AEE international curriculum, we thrive for excellence by keeping class sizes manageable and we believe that every child has the ability to excel. Our school Ranges from Grade RR-12. 147 Dookran Rd, Northdale, Pietermaritzburg, 3201, South AfricaMonday7:00 am - 3:00 pmTuesday7:00 am - 3:00 pmWednesday7:00 am - 3:00 pmThursday7:00 am - 3:00 pmFriday7:00 am - 3:00 pmSaturdayClosedSundayClosed
							November 8, 2024 10:43 am local time","147 Dookran Rd, Northdale, Pietermaritzburg, 3201, South Africa"
Kwazulu Natal,Midlands,office@thembelihleschool.co.za,,,https://saprivateschools.co.za/listing/thembelihle-primary-pre-school/,CAPS,,Kwazulu Natal,Grade RR,Grade R,7:00 am - 3:00 pm,"Thembelihle Primary School is an independent school that provides quality education to young children from disadvantaged backgrounds in the village of Howick in the Province of KwaZulu-Natal in South Africa. The school is a non profit organisation and caters for almost 300 children in grades RRR through to grade 7.90 Main St, Howick, 3290, South AfricaMonday7:00 am - 3:00 pmTuesday7:00 am - 3:00 pmWednesday7:00 am - 3:00 pmThursday7:00 am - 3:00 pmFriday7:00 am - 3:00 pmSaturdayClosedSundayClosed
							November 8, 2024 10:43 am local time","90 Main St, Howick, 3290, South Africa"
Gauteng,Johannesburg,sharon@salvazione.org,,,https://saprivateschools.co.za/listing/salvazione-christian-primary-school/,Religion Studies,Business Studies,Tourism,History,Agricultural Sciences,7:00 am - 3:00 pm,"Salvazione Christian School is an independent primary school located at 106, 106 Nurney Avenue, Johannesburg, Johannesburg in Gauteng Province, South Africa. The School's post office box number is at P O Box 96404 Brixton 1710. Salvazione Christian School is an ordinary school specializing in ordinary subjects.Jason St & St Albans Ave, Mayfair West, Johannesburg, 2092, South AfricaMonday7:00 am - 3:00 pmTuesday7:00 am - 3:00 pmWednesday7:00 am - 3:00 pmThursday7:00 am - 3:00 pmFriday7:00 am - 3:00 pmSaturdayClosedSundayClosed
							November 8, 2024 10:43 am local time","Jason St & St Albans Ave, Mayfair West, Johannesburg, 2092, South Africa"
Western Cape,Blouberg,admin@wccschool.co.za,215544229,,https://saprivateschools.co.za/listing/west-coast-christian-school-2/,Archery,Athletics,Dance,Choir,Afrikaans,8:00 am - 3:00 pm,"West Coast Christian School is a Private Christian School using ACE & Switched On Education Curriculums, and we are located in the Table View, Western Cape area. Mission Guide each learner into a personal relationship with God through Jesus Christ, and discover his gifts, talents, abilities, potential and destiny. Provide a Christian environment with Biblical character and values in which each learner can be educated and achieve academic excellence. Appoint qualified teachers who are firmly grounded in their relationship with God and who are able to pass their experience on to the children. Expose each learner to different life situations through an innovative individualized approach and help him find suitable Biblical solutions to overcome his problems. Facilitate participation in physical education, sporting and cultural activities.1 Sandown Rd, West Beach, Cape Town, 7441, South AfricaMonday8:00 am - 3:00 pmTuesday8:00 am - 3:00 pmWednesday8:00 am - 3:00 pmThursday8:00 am - 3:00 pmFriday8:00 am - 3:00 pmSaturdayClosedSundayClosed
							November 8, 2024 10:43 am local time","1 Sandown Rd, West Beach, Cape Town, 7441, South Africa"
