Province,Town,Email,Phone,Website,Website1,Gender,Language,Curriculum,GradeMin,GradeMax,OpeningHours,Description,Address
Gauteng,Bloemfontein,info@castlebridgeschool.co.za,,,https://saprivateschools.co.za/listing/castle-bridge-high-school/,CAPS,,Gauteng,Facebook,Twitter,7:00 am - 3:00 pm,"Castle Bridge School caters for learner from grade R to Grade 12 and it offers an ideal environment in which to educate our leaders of tomorrow. This is special school which takes a holistic approach to educating our children. We do not focus only on academic achievements but we believe in also developing the students socially, physically and culturally. This is achieved through various extra-curricular activities that the school offers. Our Vision is: to provide a nurturing and supportive learning environment that offers a high quality education that equips young people with relevant knowledge, skills and values to be responsible and contributing citizens and family members. Our Mission is to make this a reality by: Ensuring that the school is a safe and secure environment for educators, learners, parents, workers and other stake-holders. Cnr. Kolbe Avenue &, James Dick St, Willows, Bloemfontein, 9320, South AfricaMonday7:00 am - 3:00 pmTuesday7:00 am - 3:00 pmWednesday7:00 am - 3:00 pmThursday7:00 am - 3:00 pmFriday7:00 am - 3:00 pmSaturdayClosedSundayClosed
							November 8, 2024 10:40 am local time","Cnr. Kolbe Avenue &, James Dick St, Willows, Bloemfontein, 9320, South Africa"
Gauteng,Pretoria Central,registrations@royalschools.co.za,+27 (0) 12 324 1069,https://www.royalschools.co.za/queens-private-schools-pretoria.html,https://saprivateschools.co.za/listing/royal-primary-schools-queens-private/,Agricultural Management Practices,History,Agricultural Sciences,Dramatic Arts,Computer Applications Technology (CAT),7:00 am - 3:00 pm,"In 1993 the Fourie family started one of the first affordable private schools in South Africa. In many cases learners had limited opportunities to receive quality education. With an engrained passion for education, and the support of dedicated and loyal people, the Fouries have managed to establish and grow a successful organisation over the last 28 years.310 WF Nkomo St, Pretoria West, Pretoria, 0001, South AfricaMonday7:00 am - 3:00 pmTuesday7:00 am - 3:00 pmWednesday7:00 am - 3:00 pmThursday7:00 am - 3:00 pmFriday7:00 am - 3:00 pmSaturdayClosedSundayClosed
							November 8, 2024 10:40 am local time","310 WF Nkomo St, Pretoria West, Pretoria, 0001, South Africa"
Gauteng,Johannesburg,info@orban.co.za,,,https://saprivateschools.co.za/listing/orban-private-pre-school/,Dual-Medium,English,CAPS,,Westdene,7:00 am - 3:00 pm,"Orban is a Christian based private primary and pre-primary school. The school accommodates Afrikaans and English children between the ages of 1 and 14. Orban is situated in Melville, and serves adjacent areas such as Northcliff, Auckland Park and Westdene. Some learners even come from as far as Florida and Roodepoort. Our school offers unique educational opportunities with a special focus on music, art and drama. For 5 years in a row, Orban Primary School has been award by the National Eisteddfod: ""Best overall achievement of schools in Johannesburg region.49 Winchester St, Westdene, Johannesburg, 2092, South Africa, South AfricaMonday7:00 am - 3:00 pmTuesday7:00 am - 3:00 pmWednesday7:00 am - 3:00 pmThursday7:00 am - 3:00 pmFriday7:00 am - 3:00 pmSaturdayClosedSundayClosed
							November 8, 2024 10:40 am local time","49 Winchester St, Westdene, Johannesburg, 2092, South Africa, South Africa"
Mpumalanga,Bethal,leboramath@yahoo.com,,,https://saprivateschools.co.za/listing/young-harvest-christian-high-school/,,Mpumalanga,,,,7:00 am - 3:00 pm,"This school's description is currently being updated and will appear within the near future.4 Andries Pretorius St, New Bethal East, Bethal, 2309, South AfricaMonday7:00 am - 3:00 pmTuesday7:00 am - 3:00 pmWednesday7:00 am - 3:00 pmThursday7:00 am - 3:00 pmFriday7:00 am - 3:00 pmSaturdayClosedSundayClosed
							November 8, 2024 10:40 am local time","4 Andries Pretorius St, New Bethal East, Bethal, 2309, South Africa"
Kwazulu Natal,Pietermaritzburg,marketing@stjohnsdsg.com,https://www.bishops.org.za/,,https://saprivateschools.co.za/listing/st-johns-diocesan-primary-school-for-girls/,Information Technology,English,Life Sciences,African Languages,Physical Sciences,7:00 am - 3:00 pm,"St John's D.S.G. is an Anglican school in Pietermaritzburg open to girls from Grade RR to Grade 12. At St John's we celebrate and nurture spiritual, intellectual, emotional and physical potential. This enables us to engage with the complexities of, and contribute meaningfully to, our immediate and broader environment with integrity, insight and compassion. ? See Pietermaritzburg area on map to see other schools nearby. New England Rd, Scottsville, Pietermaritzburg, 3209, South AfricaMonday7:00 am - 3:00 pmTuesday7:00 am - 3:00 pmWednesday7:00 am - 3:00 pmThursday7:00 am - 3:00 pmFriday7:00 am - 3:00 pmSaturdayClosedSundayClosed
							November 8, 2024 10:40 am local time","New England Rd, Scottsville, Pietermaritzburg, 3209, South Africa"
Limpopo,Polokwane,admin@northernacademy.co.za,,,https://saprivateschools.co.za/listing/northern-academy-primary-school/,Mechanical Technology,Information Technology,English,Music,African Languages,7:00 am - 3:00 pm,"We provide academic instruction to prepare a learner for a worthy and meaningful position in the community. Each learner must be known and instructed individually as to develop to his/her full potential. To provide all our staff with the necessary knowledge (in-house training, workshops, etc.) Our vision To provide for the learner's intellectual, physiological, physical and emotional needs. To cultivate in the learners an interest in educational instruction. To provide team and social activities to the benefit of the learners. To grant prizes and awards to the Academy of Meritorious Students. To motivate all staff to be dedicated, competent and to behave in a professional manner at all times. Northern Academy high school, Suid Street, Flora Park, Polokwane, South Africa, South AfricaMonday7:00 am - 3:00 pmTuesday7:00 am - 3:00 pmWednesday7:00 am - 3:00 pmThursday7:00 am - 3:00 pmFriday7:00 am - 3:00 pmSaturdayClosedSundayClosed
							November 8, 2024 10:40 am local time","Northern Academy high school, Suid Street, Flora Park, Polokwane, South Africa, South Africa"
Gauteng,Jhb East,info@creativekidsdaycare.co.za,,,https://saprivateschools.co.za/listing/creative-kids-pre-school/,CAPS,,Gauteng,Grade RR,Grade R,7:00 am - 3:00 pm,"Creative Kids GROUP consists of private schools situated in Dinwiddie, Germiston, Johannesburg. Creative Kids GROUP was started in 2007 to provide kids with the service they deserve, with Creativity, Integrity and Diversity. Importance of early childhood development. The emotional, social and physical development of young children has a direct effect on their overall development and on the adult they will become. Consequently, understanding the need to invest in very young children is so important, so as to maximise their future well-being. Creative Kids GROUP aims to provide children with the best education; we strive to develop children in the best way possible in all learning fields. We will teach your child: Basic Shapes Colors The Alphabet Imaginative & Cooperative Play Fine Motor Skills Gross Motor Skills Social Skills & Independence Creative Kids GROUP is owned by the Directors Adv. Roberto and Corli Carratu, both schools have their own Principal who manages the school. Our Teachers have qualifications in Early Childhood Development as well as training in Basic First Aid, CPR and Choking.11 Woodkirk Rd, Dinwiddie, Germiston, 1401, South AfricaMonday7:00 am - 3:00 pmTuesday7:00 am - 3:00 pmWednesday7:00 am - 3:00 pmThursday7:00 am - 3:00 pmFriday7:00 am - 3:00 pmSaturdayClosedSundayClosed
							November 8, 2024 10:40 am local time","11 Woodkirk Rd, Dinwiddie, Germiston, 1401, South Africa"
Limpopo,Groblersdal,secretarygcschool@gmail.com,,,https://saprivateschools.co.za/listing/groblersdal-christian-primary-school/,Visual Arts,Geography,Agricultural Management Practices,Dance Studies,Civil Technology,7:00 am - 3:00 pm,"Groblersdal Christian School was established in 1999 by Pastor Fanna Harmse. The school only had 4 students and was situated out on the farm of the Van Vuuren family. Susan van Vuuren was our first Supervisor. In 2000 we had 3 students in town and 11 students on the farm, with 2 Supervisors and 2 Monitors. Due to the growth of the school we moved to town and was situated in the hall of the AFM Church with 32 students. After the completion of the Lewende Woord church building the school moved to it. Because of constant growth of the school, a new school building was built and completed on the grounds of the Lewende Woord church by 2003. Mrs Veronica Steyn was appointed principal of the school in February 2006, we only had 38 learners at this point. We still occupied the school building at Lewende Woord church. As Christian Education was brought more and more to the doorstep of the public, applications came rolling in. In January 2007 the school opened with 48 students Our vision is to reach the nation, one child at a time.1 Muller St, Groblersdal, 0470, South AfricaMonday7:00 am - 3:00 pmTuesday7:00 am - 3:00 pmWednesday7:00 am - 3:00 pmThursday7:00 am - 3:00 pmFriday7:00 am - 3:00 pmSaturdayClosedSundayClosed
							November 8, 2024 10:40 am local time","1 Muller St, Groblersdal, 0470, South Africa"
Gauteng,Sandton,principal@sandhurstprep.co.za,(011) 784 0452,https://sandhurstprep.co.za/,https://saprivateschools.co.za/listing/sandhurst-pre-school/,Co-Ed (Mixed),English,,Sandhurst,Grade RR,,"At Sandhurst Pre- & Preparatory College we as qualified teachers and educators, want to ensure that we afford all the boys and girls entrusted to our care the same opportunities that will create life long special memories to value and treasure as they grow. Our dedicated and passionate team of highly-skilled staff hold Bachelor and Honours degrees and all have specialised in education ensuring that your child is afforded access to a world-class education, in a unique school setting.81 Olympia Ave, Parkmore, Sandton, 2196, South AfricaMondayN/ATuesdayN/AWednesdayN/AThursdayN/AFridayN/ASaturdayClosedSundayClosed
							November 8, 2024 10:40 am local time","81 Olympia Ave, Parkmore, Sandton, 2196, South Africa"
Bela Bela,Bushveld town,info@academia.org.za,,,https://saprivateschools.co.za/listing/academia-private-primary-school/,Cambridge,,Bela Bela,Facebook,Twitter,7:00 am - 3:00 pm,"The mission of Academia Private School includes a commitment to responsible education. The Christian faith is the basis of all teaching, learning and educational activities, as well as planning, organization and management. Faith serves as the motivation of our ideals. In order to realize these ideals, an educational climate is created where very student and teacher can thrive to their full potential. Key principles are: Human Dignity Care for each other Individualization Compassion24 Ludorf St, Bela-Bela, 0480, South Africa24 Ludorf St, Bela-Bela, 0480, South AfricaMonday7:00 am - 3:00 pmTuesday7:00 am - 3:00 pmWednesday7:00 am - 3:00 pmThursday7:00 am - 3:00 pmFriday7:00 am - 3:00 pmSaturdayClosedSundayClosed
							November 8, 2024 10:40 am local time","24 Ludorf St, Bela-Bela, 0480, South Africa"
Gauteng,Krugersdorp,info@ambulante.co.za,+27 11 954 3867,https://www.ambulante.co.za/,https://saprivateschools.co.za/listing/ambulante-academy-3/,Mathematics,Accounting,Music,Business Studies,Tourism,7:00 am - 3:00 pm,"In an ideal world, there would be mainstream schools where pupils are educated in a way that is understandable according to each pupil?s individual needs. Every pupil would be on the same level of education as their peers by the end of their school careers and would be able to pursue the same opportunities. At Ambulante Academy that scenario is already our reality. Ambulante Academy was inspired by the success story of a parent who refused to give up when her child was diagnosed with developmental challenges that would prevent him from coping with mainstream education. Our Story Ambulante Academy was inspired by the success story of a parent who refused to give up when her child was diagnosed with developmental challenges that would prevent him from coping with mainstream education. Through their challenging journey the owner was led by her Christian faith and found inspiration in two Bible verses.292 Voortrekker Rd, Noordheuwel, Krugersdorp, 1739, South AfricaMonday7:00 am - 3:00 pmTuesday7:00 am - 3:00 pmWednesday7:00 am - 3:00 pmThursday7:00 am - 3:00 pmFriday7:00 am - 3:00 pmSaturdayClosedSundayClosed
							November 8, 2024 10:40 am local time","292 Voortrekker Rd, Noordheuwel, Krugersdorp, 1739, South Africa"
Gauteng,Online,info@wingu-academy.com,,,https://saprivateschools.co.za/listing/wingu-academy-high-school/,CAPS,,Gauteng,Instagram,YouTube,7:00 am - 3:00 pm,"We are Wingu Academy, and we've started delivering high quality education to eager minds in the whole of Africa. Wingu is the Swahili word for cloud â€“ clouds are everywhere and we believe that education should be too! We offer education from the cloud to bring world class education into your home. Wingu Academy uses current and innovative teaching and learning methods. Wingu Academy's expert staff is highly trained to provide the best possible support. No two students are the same and here at Wingu Academy we embrace all differences by providing bespoke educational solutions that meet the individual needs of our parents and learners. Wingu Academy was started in January 2020 by a passionate group of founders who realised that the educational landscape is evolving and the need for innovative educational solutions are ever changing. We open our online doors for Grade 10 â€“ 12 students in January 2022 for the British International AS/A level curriculum.Cnr Lynnwood and Roper, University of Pretoria, Humanities Building floor 14, Hatfield, Pretoria, 0002, South AfricaMonday7:00 am - 3:00 pmTuesday7:00 am - 3:00 pmWednesday7:00 am - 3:00 pmThursday7:00 am - 3:00 pmFriday7:00 am - 3:00 pmSaturdayClosedSundayClosed
							November 8, 2024 10:40 am local time","Cnr Lynnwood and Roper, University of Pretoria, Humanities Building floor 14, Hatfield, Pretoria, 0002, South Africa"
Kwazulu Natal,Eshowe,office@gratton.co.za,,,https://saprivateschools.co.za/listing/gratton-primary-school/,Agricultural Sciences,Consumer Studies,Agricultural technology,Engineering Graphics and Design,Electrical Technology,7:00 am - 3:00 pm,"Gratton is defined by our learners who are our finest ambassadors. The school community is diverse and we welcome students of all faiths and backgrounds. Gratton is an affordable boarding and day school. Gratton provides all learners with the opportunity to grow and realise their full and unique potential. Gratton offers small classes, dedicated staff, free extra classes and a range of academic, cultural and sporting activities. Gratton caters for the diverse learning requirements of its learners who enjoy individual attention and early career mentorship. Find school fees here and for other admissions information, please contact us.Old Zululand Showground, Eshowe, 3815, South AfricaMonday7:00 am - 3:00 pmTuesday7:00 am - 3:00 pmWednesday7:00 am - 3:00 pmThursday7:00 am - 3:00 pmFriday7:00 am - 3:00 pmSaturdayClosedSundayClosed
							November 8, 2024 10:40 am local time","Old Zululand Showground, Eshowe, 3815, South Africa"
Kwazulu Natal,Pietermaritzburg,marketing@twc.org.za,,,https://saprivateschools.co.za/listing/the-wykeham-collegiate-pre-school/,CAPS,,Kwazulu Natal,Facebook,Twitter,7:00 am - 3:00 pm,"This school's description is currently being updated and will appear within the near future.100 Villiers Dr, Clarendon, Pietermaritzburg, 3201, South AfricaMonday7:00 am - 3:00 pmTuesday7:00 am - 3:00 pmWednesday7:00 am - 3:00 pmThursday7:00 am - 3:00 pmFriday7:00 am - 3:00 pmSaturdayClosedSundayClosed
							November 8, 2024 10:40 am local time","100 Villiers Dr, Clarendon, Pietermaritzburg, 3201, South Africa"
Kwazulu Natal,Berea,admissions@dgc.co.za,,,https://saprivateschools.co.za/listing/durban-girls-primary-school/,Electrical Technology,Hospitality Studies,Mechanical Technology,Mathematics,Accounting,7:00 am - 3:00 pm,"Durban Girls' College stands both as a landmark on Durban's Berea and as a benchmark for excellence in education. The fine buildings and extensive grounds offer sweeping views of the Durban beachfront and the Indian Ocean. Home for 810 girls from reception year to Grade 12, the school succeeds in creating a warm and caring foundation which instils in the pupils a life-long love of learning and a redoubtable work ethic. The career paths of Old Girls are testimony to the preparation for life which College provides. 586 Musgrave Rd, Essenwood, Durban, 4001, South AfricaMonday7:00 am - 3:00 pmTuesday7:00 am - 3:00 pmWednesday7:00 am - 3:00 pmThursday7:00 am - 3:00 pmFriday7:00 am - 3:00 pmSaturdayClosedSundayClosed
							November 8, 2024 10:40 am local time","586 Musgrave Rd, Essenwood, Durban, 4001, South Africa"
Western Cape,West Coast,info@melkbosprivate.co.za,,,https://saprivateschools.co.za/listing/melkbosstrand-private-pre-school/,CAPS,,Western Cape,Grade RR,Grade R,7:00 am - 3:00 pm,"Melkbosstrand Private School is a Christian school situated in the beautiful country side of Melkbosstrand, Cape Town. We are a proudly-South African co-educational parallel-medium school. It offers its students a world-class, balanced education which focuses on Bible education, academic, physical, cultural, musical and the emotional development of each student in an attractive and inviting country environment. The school offers formal schooling from 18 months to matric on the same campus but in separate facilities. Melkbosstrand Private School follows the National Curriculum. Our first group of Grade 12's matriculated in 2011 and we are very proud to say that they achieved a 100% pass rate. The school offers all major sports. Matches are held regularly against other private and government schools. Our sporting infrastructure includes tennis courts, netball courts, rugby, cricket and hockey fields and cricket practice nets.Melkbosstrand Private School, M19, Melkbosstrand, Cape Town, South Africa, South AfricaMonday7:00 am - 3:00 pmTuesday7:00 am - 3:00 pmWednesday7:00 am - 3:00 pmThursday7:00 am - 3:00 pmFriday7:00 am - 3:00 pmSaturdayClosedSundayClosed
							November 8, 2024 10:40 am local time","Melkbosstrand Private School, M19, Melkbosstrand, Cape Town, South Africa, South Africa"
Gauteng,Sandton,admissions@heronbridge.co.za,,,https://saprivateschools.co.za/listing/heronbridge-pre-school/,CAPS,,Gauteng,Grade RR,Grade R,7:00 am - 3:00 pm,"Educating Young South Africans With Heart At HeronBridge College, we believe that all children are gifted and talented by God in different areas but still need to learn life skills. We aim to educate children in such a way so as to achieve their personal best while allowing them to honourably face the challenges that life places in their path, thereby glorifying God. HeronBridge College Pre-Preparatory Young children are unique and need adults to care for them and teach them in ways that enhance all areas of their development, i.e. social, emotional, physical, cognitive and spiritual. It also recognizes the vast amount of development that occurs in the early years of a child's life and hence the need to explore, experience and discover different things in their immediate environment. HeronBridge provides a suitable Pre-Preparatory Curriculum by ensuring that our curriculum is founded on strong Perceptual Motor Development skills, which forms the foundation of learning to read, write and do mathematics. Our programme, as it is referred to in the early childhood years , is set out in the form of adult guided activities, child initiated activities and routine.No 36 on the R114 Nietgedacht, Fourways, Johannesburg, 1747, South AfricaMonday7:00 am - 3:00 pmTuesday7:00 am - 3:00 pmWednesday7:00 am - 3:00 pmThursday7:00 am - 3:00 pmFriday7:00 am - 3:00 pmSaturdayClosedSundayClosed
							November 8, 2024 10:41 am local time","No 36 on the R114 Nietgedacht, Fourways, Johannesburg, 1747, South Africa"
Western Cape,South Peninsula,sunbeamns@telkomsa.net,,,https://saprivateschools.co.za/listing/sunbeam-nursery-pre-school/,CAPS,,Western Cape,Grade RR,Grade R,7:00 am - 3:00 pm,"Sunbeam Nursery School is a private Preschool situated in Sun Valley, Fish Hoek, Cape Town. The garden has several trees suitable for climbing, a large outdoor Jungle Gym, swings and see-saw as well as a large sandpit under cover. Children ride bicycles and other wheel toys on a concreted area provided. Grass surrounds the school and many interesting areas are the backdrop for the children's imaginary games. Sunbeam has four age groups. Ages 2-3 (provided they are being potty trained), 3-4 year olds, 4-5 year olds and 5-6 year olds (Grade R). The programs followed are in line with the other fully registered recognised pre-schools. Sunbeam feeds local schools with many children, and is also an official feeder school for The Rock Academy. Our Sunbeam teachers have the qualifications needed as well as many years' active experience in working with preschool children. The Staff members, together with Mrs. Raphael the principal and visionary, have a great respect and love for children and parents alike. Their God-given ability, training and experience, help the children to feel secure; whilst their enthusiastic approaches to teaching, bring the children into a place of interest and enjoyment, thus causing the growth and development required for Grade 1.17 Dhow St, Sun Valley, Cape Town, 7985, South AfricaMonday7:00 am - 3:00 pmTuesday7:00 am - 3:00 pmWednesday7:00 am - 3:00 pmThursday7:00 am - 3:00 pmFriday7:00 am - 3:00 pmSaturdayClosedSundayClosed
							November 8, 2024 10:41 am local time","17 Dhow St, Sun Valley, Cape Town, 7985, South Africa"
Western Cape,Helderberg,secretary@newberry.co.za,,,https://saprivateschools.co.za/listing/newberry-house-montessori-pre-school/,CAPS,,Western Cape,Grade RR,Grade R,7:00 am - 3:00 pm,"One of the goals of a Montessori education is to establish a secure, friendly and caring environment within which to teach students positive and appropriate ways to handle situations. Our focus therefore lies in assisting our students to develop a strong sense of self-discipline, love of learning, contribution to society, sustainable living, responsibility and courtesy.Lourensford Road, Lourensford Wine Estate, Natures Valley, Somerset West, 7140, South AfricaMonday7:00 am - 3:00 pmTuesday7:00 am - 3:00 pmWednesday7:00 am - 3:00 pmThursday7:00 am - 3:00 pmFriday7:00 am - 3:00 pmSaturdayClosedSundayClosed
							November 8, 2024 10:41 am local time","Lourensford Road, Lourensford Wine Estate, Natures Valley, Somerset West, 7140, South Africa"
Western Cape,Cape Town,v.funani@isct.co.za,,,https://saprivateschools.co.za/listing/international-pre-school-of-cape-town/,CAPS,,Western Cape,Grade RR,Grade R,7:00 am - 3:00 pm,"International School of Cape Town The International School of Cape Town is not subsidised in any way by the State. To ensure high standards of education, class size will be limited to 20 students per class in Primary School and 24 in High School. School fees include all textbooks and educational materials. Our fees are set at a level, which covers operating expenditure and capital development is covered by a R7500 non-refundable placement fee. Tuition fees are in line with other member schools of the Independent Schools Association of South Africa. Parents interested in enrolling their children are invited to arrange an interview with the Admissions Officer to visit the school and meet with the relevant Key Stage Head in the Primary School or the Director of Studies in the High School. An information pack, including an Application Form will be handed to you at the interview. Appropriate placement tests will take place once an application form, together with R500 registration fee (R650 if paying in foreign currency), is received by us.Edinburgh Drive, Wynberg, Cape Town, South Africa, South AfricaMonday7:00 am - 3:00 pmTuesday7:00 am - 3:00 pmWednesday7:00 am - 3:00 pmThursday7:00 am - 3:00 pmFriday7:00 am - 3:00 pmSaturdayClosedSundayClosed
							November 8, 2024 10:41 am local time","Edinburgh Drive, Wynberg, Cape Town, South Africa, South Africa"
Western Cape,Winelands,info@newhavenacademy.co.za,,,https://saprivateschools.co.za/listing/new-haven-academy-pre-school/,CAPS,,Western Cape,Grade RR,Grade R,7:00 am - 3:00 pm,"Students are expected to take at least 1 college course and at least 2 elective courses by the end of 12th grade. These courses are made possible through the Gateway Community College Early College Partnership and the NHA/Quinnipiac University Dual Enrollment Program.62-64 Third St, Park Rynie, 4182, South AfricaMonday7:00 am - 3:00 pmTuesday7:00 am - 3:00 pmWednesday7:00 am - 3:00 pmThursday7:00 am - 3:00 pmFriday7:00 am - 3:00 pmSaturdayClosedSundayClosed
							November 8, 2024 10:41 am local time","62-64 Third St, Park Rynie, 4182, South Africa"
