Province,Town,Email,Phone,Website,Website1,Gender,Language,Curriculum,GradeMin,GradeMax,OpeningHours,Description,Address
Western Cape,George,admin@kingsleyprivateschool.co.za,,,https://saprivateschools.co.za/listing/kingsley-private-primary-school/,Mechanical Technology,Information Technology,English,Music,African Languages,7:00 am - 3:00 pm,"Kingsley Private uses; among others; Accelerated Christian Education System (ACE), a comprehensive educational system, driven by dedicated Educators who motivate and support parents in their quest to help their children reach their maximum potential in school and in life. The ACE program utilises results-driven processes rather than conventionally applied time-focussed education curricula. At Kingsley we determine each student's Unique Learning Profile (genetic) with God-given abilities and talents and has developed a learning approach that accommodates learners' individual capabilities. The curriculum makes it possible for the learner, to achieve their full academic potential. This is the foundation upon which future learning is built. From preschool to grade 12, each learner discovers how to: Set goals and meet deadlines Develop critical-thinking skills Think creatively and independently The ACE program covers the critical outcomes and minimum standards of the National Curriculum Statements (NCS) as prescribed by the Department of Education in South Africa. This includes Learner and Teacher Support Materials (LTSM's). See George area on map to see other schools nearby.Kingsley All in One Educentre (Private School), Albert Street, George South, George, South Africa, South AfricaMonday7:00 am - 3:00 pmTuesday7:00 am - 3:00 pmWednesday7:00 am - 3:00 pmThursday7:00 am - 3:00 pmFriday7:00 am - 3:00 pmSaturdayClosedSundayClosed
							November 11, 2024 8:50 am local time","Kingsley All in One Educentre (Private School), Albert Street, George South, George, South Africa, South Africa"
Gauteng,Sandton,school@clps.co.za,,,https://saprivateschools.co.za/listing/christian-life-private-primary-school/,Computer Applications Technology (CAT),Engineering Graphics and Design,Electrical Technology,Life Sciences,Mathematical Literacy,7:00 am - 3:00 pm,"We strive for academic excellence in a well-disciplined, friendly and supportive environment. As you walk through our classrooms and grounds, you will feel and see a sense of peace and diligence and a look of joy on the faces of our staff and children.15 Twain Ave, Buccleuch, Sandton, 2090, South Africa15 Twain Ave, Buccleuch, Sandton, 2090, South AfricaMonday7:00 am - 3:00 pmTuesday7:00 am - 3:00 pmWednesday7:00 am - 3:00 pmThursday7:00 am - 3:00 pmFriday7:00 am - 3:00 pmSaturdayClosedSundayClosed
							November 11, 2024 8:51 am local time","15 Twain Ave, Buccleuch, Sandton, 2090, South Africa"
Kwazulu Natal,Pietermaritzburg,marketing@epworth.co.za,,,https://saprivateschools.co.za/listing/epworth-girls-high-school/,CAPS,,Kwazulu Natal,Instagram,YouTube,7:00 am - 3:00 pm,"Epworth High School for Girls is one of South Africa's leading and most sought-after independent schools, providing a rich and holistic education for girls - boarders and day scholars - from Grade 8 to Grade 12.? Epworth is located in Pietermaritzburg, KwaZulu-Natal on a picturesque 15-hectare park-like campus with an enviable range of facilities. It has a distinct Methodist ethos and boasts over 120 years of nurturing and moulding young women into responsible citizens. ? The small tight-knit community of approximately 370 pupils allows each girl to find her niche and to grow and excel so that she can reach her full potential. There are three classes per grade with a maximum of 26 pupils per class. Epworth consistently achieves 100 percent pass rate in the National Independent Examination Board (IEB) Senior Certificate examinations. The majority of Grade 12 pupils are accepted for tertiary studies at their universities of choice.? At Epworth, learning extends well beyond the classroom. Thriving sporting, cultural and outreach programmes complement the excellent academic curriculum, encouraging discipline and teamwork. ? See Pietermaritzburg area on map to see other schools nearby. 95 Golf Rd, Scottsville, Pietermaritzburg, 3201, South AfricaMonday7:00 am - 3:00 pmTuesday7:00 am - 3:00 pmWednesday7:00 am - 3:00 pmThursday7:00 am - 3:00 pmFriday7:00 am - 3:00 pmSaturdayClosedSundayClosed
							November 11, 2024 8:51 am local time","95 Golf Rd, Scottsville, Pietermaritzburg, 3201, South Africa"
Western Cape,Somerset West,info@mondeorecoschool.co.za,,,https://saprivateschools.co.za/listing/mondeor-eco-high-school/,CAPS,,Western Cape,Facebook,Twitter,7:00 am - 3:00 pm,"Mondeor Eco School began in 2007 with one learner and one teacher. There are now more than 350 learners and more than 70 staff! With our first decade behind us, we set our sights on new targets. Instead of explosive growth, we want to recommit to sustainability, responsibility and community. With this in mind, we are rooted in our values and the things that have made our school what it is today. Our efforts are aimed at being recognised as an institution and having a presence in the community. We hope this website expresses our renewed vision for the future, and what we can offer as an institution. See Somerset West area on map to see other schools nearby.Mondeor Eco School, Mondeor Road, Helderberg Rural, Sir Lowry""s Pass, South Africa, South AfricaMonday7:00 am - 3:00 pmTuesday7:00 am - 3:00 pmWednesday7:00 am - 3:00 pmThursday7:00 am - 3:00 pmFriday7:00 am - 3:00 pmSaturdayClosedSundayClosed
							November 11, 2024 8:51 am local time","Mondeor Eco School, Mondeor Road, Helderberg Rural, Sir Lowry""s Pass, South Africa, South Africa"
Kwazulu Natal,Estcourt,info@mccmidlands.co.za,,,https://saprivateschools.co.za/listing/estcourt-christian-academy-high-school/,CAPS,,Kwazulu Natal,Instagram,YouTube,7:00 am - 3:00 pm,"January 1998 saw the opening of our Christian School (Estcourt Christian Academy) on the church premises in Estcourt, which provides children with education from Grade One to Grade Twelve. ECA is situated at the Centre, operates the Accelerated Christian Education programme and caters for children from Grade One to Grade Twelve. ? Good St, Brewitt Park, Estcourt, 3310, South AfricaMonday7:00 am - 3:00 pmTuesday7:00 am - 3:00 pmWednesday7:00 am - 3:00 pmThursday7:00 am - 3:00 pmFriday7:00 am - 3:00 pmSaturdayClosedSundayClosed
							November 11, 2024 8:51 am local time","Good St, Brewitt Park, Estcourt, 3310, South Africa"
Jhb South,Alberton,optim-ed@vodamail.co.za,http://www.sggs.co.za/,,https://saprivateschools.co.za/listing/optim-ed-learning-centre-primary-school/,English,IEB,,Gauteng,Facebook,7:00 am - 3:00 pm,"Optim-Ed Learning Centre is an independent special needs school located in Alberton Johannesburg. We cater for learners aged between 3 years to 18 years of age that have special educational or physical needs. Optim-Ed Learning Centre is registered with the Department of Education as a special needs school. The school was founded in 2009 by Morgen Erasmus and Dr Tracey Naude and is founded on Christian principles. Our aim is to allow each individual the opportunity to reach his/her fullest potential and be an active member of society. Our motto is ""A Window of Opportunity"". We believe that working holistically we give learners the opportunity to reach their potential. ? Mission and Vision Statement To provide all learners with a nurturing, structured and stimulating learning environment in which each child can develop his/her unique personality and positive self-concept through education, support, play and love. Emotional and social skills to become functional citizens in society where they may make a contribution in a sheltered working environment. ? ? See Alberton area on map to see other schools nearby.Optim - Ed Learning Centre, Bamboo St, Brackendowns, Alberton, South Africa, South AfricaMonday7:00 am - 3:00 pmTuesday7:00 am - 3:00 pmWednesday7:00 am - 3:00 pmThursday7:00 am - 3:00 pmFriday7:00 am - 3:00 pmSaturdayClosedSundayClosed
							November 11, 2024 8:51 am local time","Optim - Ed Learning Centre, Bamboo St, Brackendowns, Alberton, South Africa, South Africa"
Kwazulu Natal,Pinetown,0317022614@efg.co.za,,,https://saprivateschools.co.za/listing/forest-dene-preprimary-and-creche-pre-school/,CAPS,,Kwazulu Natal,Facebook,Twitter,7:00 am - 3:00 pm,"This school's description is currently being updated and will appear within the near future.34 Bartlett Rd, Farningham Ridge, Pinetown, 3610, South AfricaMonday7:00 am - 3:00 pmTuesday7:00 am - 3:00 pmWednesday7:00 am - 3:00 pmThursday7:00 am - 3:00 pmFriday7:00 am - 3:00 pmSaturdayClosedSundayClosed
							November 11, 2024 8:51 am local time","34 Bartlett Rd, Farningham Ridge, Pinetown, 3610, South Africa"
Gauteng,Midrand,midrand@taalct.co.za,,,https://saprivateschools.co.za/listing/taal-net-midrand-high-school/,CAPS,,Gauteng,Facebook,Twitter,7:00 am - 3:00 pm,"Study the Taal -Net way is the flexible, accessible way to brush up on your skills, advance your career and realize your dreams. Taal-Net International makes it easier for you. You will also have access to individual attention from qualified tutors and other support staff. 520 Boxer Rd, Glen Austin AH, Midrand, 1685, South AfricaMonday7:00 am - 3:00 pmTuesday7:00 am - 3:00 pmWednesday7:00 am - 3:00 pmThursday7:00 am - 3:00 pmFriday7:00 am - 3:00 pmSaturdayClosedSundayClosed
							November 11, 2024 8:51 am local time","520 Boxer Rd, Glen Austin AH, Midrand, 1685, South Africa"
Kwazulu Natal,Pinetown,mdimarco@stmarysdsg.co.za,,,https://saprivateschools.co.za/listing/st-marys-dsg-kloof-primary-school/,IEB,,Kwazulu Natal,Facebook,Twitter,7:00 am - 3:00 pm,"Offering boarding from Grade 8. We believe that inspired girls become remarkable women, which is why we strive to help instill in our girls the curiosity to think, and the character to thrive, and we've been doing this since 1906. 30 St Marys Rd, Kloof, Durban, 3640, South AfricaMonday7:00 am - 3:00 pmTuesday7:00 am - 3:00 pmWednesday7:00 am - 3:00 pmThursday7:00 am - 3:00 pmFriday7:00 am - 3:00 pmSaturdayClosedSundayClosed
							November 11, 2024 8:51 am local time","30 St Marys Rd, Kloof, Durban, 3640, South Africa"
Gauteng,Centurion,info@pvrca.co.za,https://shelantiprivateschool.co.za/,,https://saprivateschools.co.za/listing/pierre-van-ryneveld-christian-academy-high-school/,English,Afrikaans,Dual-Medium,Centurion,Facebook,7:00 am - 3:00 pm,"We are a non-racial, church-based, Christian School with a mission to serve the families of our school. Our objective is to provide a Christ-centred, Bible-based excellent academic education, which will equip students with Christian character and life skills to enable them to fulfill their God appointed potential in adult life. It is our mission to Teach children to read for knowledge Teach them to study for understanding Build their characters See Centurion Schools Pierre Van Ryneveld Christian School, Spitfire Avenue, Pierre van Ryneveld Park, Centurion, South Africa, South AfricaMonday7:00 am - 3:00 pmTuesday7:00 am - 3:00 pmWednesday7:00 am - 3:00 pmThursday7:00 am - 3:00 pmFriday7:00 am - 3:00 pmSaturdayClosedSundayClosed
							November 11, 2024 8:51 am local time","Pierre Van Ryneveld Christian School, Spitfire Avenue, Pierre van Ryneveld Park, Centurion, South Africa, South Africa"
Gauteng,East Rand,info@shanan.co.za,,,https://saprivateschools.co.za/listing/shanan-christian-high-school/,CAPS,,Gauteng,Facebook,Twitter,7:00 am - 3:00 pm,"What SHANAN Christian School Has To Offer You! A Christian School which started in 1989. A school that follows the Revised National Curriculum Statement (RNCS) and uses the Accelerated Christian Education methodology as the Learner Teacher Support Material (LTSM). With this, the learner is able to progress at his/her own pace. Grade R to Grade 12. ? See Benoni area on map to see other schools nearby.Shanan Christian School, Capricorn Street, Farrarmere, Benoni, South Africa, South AfricaMonday7:00 am - 3:00 pmTuesday7:00 am - 3:00 pmWednesday7:00 am - 3:00 pmThursday7:00 am - 3:00 pmFriday7:00 am - 3:00 pmSaturdayClosedSundayClosed
							November 11, 2024 8:51 am local time","Shanan Christian School, Capricorn Street, Farrarmere, Benoni, South Africa, South Africa"
Gauteng,Sandton,admin@osummitschool.com,,,https://saprivateschools.co.za/listing/osummit-montessori-high-school/,CAPS,,Gauteng,Facebook,Twitter,7:00 am - 3:00 pm,"Our School Environments Our independent boutique school community, in the heart of Bryanston, welcomes families who consider holistic child development and learning a priority in preparing the whole child for life. We successfully balance tactile classroom learning with recognising the need for exposure to modern technology. Our campus includes 3 bespoke Montessori environments where we follow a classic Montessori Curriculum, together with a College environment where we offer the British International Curriculum. We are focused on developing an informed curiosity and a lasting passion for learning, whilst gaining the essential skills they need for success at high school, tertiary studies, and in their future careers. Visit our International School Bryanston today for a tour. ? See Bryanston area on map to see other schools nearby.17 Elgin Rd, Bryanston, Sandton, 2191, South Africa, South AfricaMonday7:00 am - 3:00 pmTuesday7:00 am - 3:00 pmWednesday7:00 am - 3:00 pmThursday7:00 am - 3:00 pmFriday7:00 am - 3:00 pmSaturdayClosedSundayClosed
							November 11, 2024 8:51 am local time","17 Elgin Rd, Bryanston, Sandton, 2191, South Africa, South Africa"
Brits,North West,inligting@hamakomps.co.za,,,https://saprivateschools.co.za/listing/hamakom-privaatskool-pre-school/,Athletics,Chess,Eisteddfod,,Brits,7:00 am - 3:00 pm,"HaMaKom is in ooreenstemming met die Suid-Afrikaanse Nasionale Akademiese Standaarde (CAPS). In elke vakgebied voldoen HaMaKom aan die standaarde van die Kurrikulum en Assesseringsbeleidsverklaring (CAPS). HaMaKom verbreed studentekennis om te verseker dat ons studente 'n goeie onderrig basis verkry. See Brits SchoolsPortion 542 of portion 359, Farm Krokodildrift West 446, Brits, 0250, South AfricaMonday7:00 am - 3:00 pmTuesday7:00 am - 3:00 pmWednesday7:00 am - 3:00 pmThursday7:00 am - 3:00 pmFriday7:00 am - 3:00 pmSaturdayClosedSundayClosed
							November 11, 2024 8:51 am local time","Portion 542 of portion 359, Farm Krokodildrift West 446, Brits, 0250, South Africa"
Vanderbijlpark,Gauteng,admin@epsvaal.org.za,,,https://saprivateschools.co.za/listing/emmanuel-private-pre-school/,CAPS,,Vanderbijlpark,Grade RR,Grade R,7:00 am - 3:00 pm,"Emmanuel Private School was started in January 1996 with the aim of providing quality Christian education in the Vaal Triangle. Our overall learner numbers fluctuate around the 200 mark and we have a fulltime staff complement of 42. Incorporated into Emmanuel Private School is the Nursery School (previously called The Little Sparrow Nursery School). This nursery school has been operational since 1976. Our main focus is on excellence in both academics and the character development of our learners. The academic programme aims at developing both learning skills and mastery of content. Development of our learners' character is highly valued and planned for. We follow the RNCS (GETC and FETC) using the LTSMS from Accelerated Christian Education (ACE), and IT curriculum from IT School Innovation and Computers for Kids. ? See Vanderbijlpark area on map to see other schools nearby.14 Totius St, Vanderbijlpark S. W. 1, Vanderbijlpark, 1911, South AfricaMonday7:00 am - 3:00 pmTuesday7:00 am - 3:00 pmWednesday7:00 am - 3:00 pmThursday7:00 am - 3:00 pmFriday7:00 am - 3:00 pmSaturdayClosedSundayClosed
							November 11, 2024 8:51 am local time","14 Totius St, Vanderbijlpark S. W. 1, Vanderbijlpark, 1911, South Africa"
Gauteng,Jhb East,shangria@mweb.co.za,,,https://saprivateschools.co.za/listing/shangri-la-academy-pre-school/,CAPS,,Gauteng,Grade RR,Grade R,7:00 am - 3:00 pm,"Day students only Girls and Boys Combined School: Gr R (6yrs) - Matric Independent Examination Board Number of pupils: 615. ? ? See Kempton Park area on map to see other schools nearby.Shangri-La Academy, Fiskaal Street, Glen marais, Kempton Park, South Africa, South AfricaMonday7:00 am - 3:00 pmTuesday7:00 am - 3:00 pmWednesday7:00 am - 3:00 pmThursday7:00 am - 3:00 pmFriday7:00 am - 3:00 pmSaturdayClosedSundayClosed
							November 11, 2024 8:51 am local time","Shangri-La Academy, Fiskaal Street, Glen marais, Kempton Park, South Africa, South Africa"
Eastern Cape,Fairview,office@brylin.co.za,https://cannonscreek.co.za/,,https://saprivateschools.co.za/listing/brylin-independent-learning-centre-pre-school/,English,CAPS,,Port Elizabeth,Grade RR,7:00 am - 3:00 pm,"ETHOS Brylin's Ethos is based on: The quality of relationships / partnerships Relationships between teachers, teachers and parents as well as the ways in which the learners and teachers treat and respect each other We focus on values such as caring, trust, student participation, communication, leadership, teamwork and respect as well as involvement and recognition Our ultimate goal is to work in harmony in order for every learner to achieve his/ her potential and to teach our learners to ultimately make the 'right choices' in life. ? See Port Elizabeth area on map to see other schools nearby.Eucalyptus Street, Fairview, 6070 Port Elizabeth, South Africa , South AfricaMonday7:00 am - 3:00 pmTuesday7:00 am - 3:00 pmWednesday7:00 am - 3:00 pmThursday7:00 am - 3:00 pmFriday7:00 am - 3:00 pmSaturdayClosedSundayClosed
							November 11, 2024 8:51 am local time","Eucalyptus Street, Fairview, 6070 Port Elizabeth, South Africa , South Africa"
Western Cape,George,ingrid@edenmontessori.co.za,https://elsen.co.za/,,https://saprivateschools.co.za/listing/eden-montessori-pre-school/,English,CAPS,,Grade R,Facebook,7:00 am - 3:00 pm,"School Vision To provide exceptional Montessori education in the Afrikaans and English languages so as to nurture and inspire every child to be the best they can possibly be. School Mission To provide a coeducational environment shaped by Christian principles. To ensure that our children leave school well prepared for life. To keep Maria Montessori's teaching central to all that we do, and endeavour to be a true Casa dei Bambini or ""Children's House"", as she envisioned it. To treat the children entrusted to us, our peers and our environment with care and respect. To be committed to maintaining a balance between spiritual, academic, cultural and outdoor activities in order to encourage well rounded development of our learners. To recognise and develop the uniqueness of each learner. To create a safe, disciplined environment conducive to learning. To never compromise on the quality of Montessori education we provide. See George Schools 116 Stander St, Eden George, George, 6529, South AfricaMonday7:00 am - 3:00 pmTuesday7:00 am - 3:00 pmWednesday7:00 am - 3:00 pmThursday7:00 am - 3:00 pmFriday7:00 am - 3:00 pmSaturdayClosedSundayClosed
							November 11, 2024 8:51 am local time","116 Stander St, Eden George, George, 6529, South Africa"
Gauteng,East Rand,info@ashburycollege.co.za,,,https://saprivateschools.co.za/listing/ashbury-pre-school/,CAPS,,Gauteng,Grade RR,Grade R,7:00 am - 3:00 pm,"Ashbury College is an independent combined school located in Fairlands, Benoni. Since 1994 the school has been renowned for excellent academic performance. The College offers education from pre-grade R to grade 12.69 Von Broemsen Rd, Fairleads, Benoni, 1512, South AfricaMonday7:00 am - 3:00 pmTuesday7:00 am - 3:00 pmWednesday7:00 am - 3:00 pmThursday7:00 am - 3:00 pmFriday7:00 am - 3:00 pmSaturdayClosedSundayClosed
							November 11, 2024 8:51 am local time","69 Von Broemsen Rd, Fairleads, Benoni, 1512, South Africa"
Gauteng,Pretoria Central,info@hatfieldmontessori.co.za,https://www.heronbridge.co.za/,,https://saprivateschools.co.za/listing/hatfield-montessori-pre-school/,English,CAPS,,Hatfield,Grade RR,7:00 am - 3:00 pm,"We believe in creating a learning community that engages both students and parents. We encourage our parents to join us in co-creating a highly caring and compassionate environment. Wondering how your child will be different after learning and growing with us? Don't take our word for it, check out what our past and current parents have to say about our school.1307 South St, Hatfield, Pretoria, 0028, South AfricaMonday7:00 am - 3:00 pmTuesday7:00 am - 3:00 pmWednesday7:00 am - 3:00 pmThursday7:00 am - 3:00 pmFriday7:00 am - 3:00 pmSaturdayClosedSundayClosed
							November 11, 2024 8:51 am local time","1307 South St, Hatfield, Pretoria, 0028, South Africa"
Western Cape,Winelands,strand@crosspointacademy.co.za,,,https://saprivateschools.co.za/listing/crosspoint-academy-pre-school/,CAPS,,Western Cape,Grade RR,Grade R,7:00 am - 3:00 pm,"The compassionate Heart of God is at the core of The Crosspoint Foundation and Crosspoint Academy; encompassing honesty, accountability, humility, and an energetic/proactive approach to lifeâ€”impacting the diverse lives of the children, parents, teachers, staff, and all who pass through our door. We are â€œguiding hearts and mindsâ€ into altruistic leaders of tomorrow.12 Pickle St, Strand, Cape Town, 7140, South AfricaMonday7:00 am - 3:00 pmTuesday7:00 am - 3:00 pmWednesday7:00 am - 3:00 pmThursday7:00 am - 3:00 pmFriday7:00 am - 3:00 pmSaturdayClosedSundayClosed
							November 11, 2024 8:51 am local time","12 Pickle St, Strand, Cape Town, 7140, South Africa"
Western Cape,George,info@glenwoodhouse.co.za,,,https://saprivateschools.co.za/listing/glenwood-house-primary-school/,Agricultural Management Practices,History,Agricultural Sciences,Dramatic Arts,Computer Applications Technology (CAT),7:00 am - 3:00 pm,"This school's description is currently being updated and will appear within the near future.1 Glenwood Ave, Glenwood AH, George, 6529, South AfricaMonday7:00 am - 3:00 pmTuesday7:00 am - 3:00 pmWednesday7:00 am - 3:00 pmThursday7:00 am - 3:00 pmFriday7:00 am - 3:00 pmSaturdayClosedSundayClosed
							November 11, 2024 8:51 am local time","1 Glenwood Ave, Glenwood AH, George, 6529, South Africa"
Nelspruit,Mbombela,acaciavoorskool@gmail.com,,,https://saprivateschools.co.za/listing/acacia-montessori-pre-primary/,CAPS,,Nelspruit,Grade RR,Grade R,7:00 am - 3:00 pm,"Acacia Pre-primary school is a Montessori based school in Nelspruit, Mpumalanga. We cater for children from 3 months to six years. At Acacia pre-primary we are one happy family. We are registered with the department of Health and the department of Social Development.17 Mandulia St, West Acres, Mbombela, 1200, South Africa17 Mandulia St, West Acres, Mbombela, 1200, South AfricaMonday7:00 am - 3:00 pmTuesday7:00 am - 3:00 pmWednesday7:00 am - 3:00 pmThursday7:00 am - 3:00 pmFriday7:00 am - 3:00 pmSaturdayClosedSundayClosed
							November 11, 2024 8:52 am local time","17 Mandulia St, West Acres, Mbombela, 1200, South Africa"
Gauteng,Pretoria East,kidsacademy2@polka.co.za,,,https://saprivateschools.co.za/listing/kiddies-academy-equestria-pre-school/,CAPS,,Gauteng,Grade RR,Grade R,7:00 am - 3:00 pm,"Kiddies Academy CC has been a leading provider of exceptional quality care & early year's education for the past 18 years. The founders, Mrs. Z. Kriek & Mrs. C. Jooste both Educational Psychologists, has stayed true to their commitment & approach to childcare: Creating a warm, secure, friendly environment where each child is encouraged to reach their full potential through praise, sensitivity & mutual respect. To maintain well organised, aesthetically & environmentally appealing facilities. To provide a care facility where parents are happy to leave their children secure in the knowledge that their children will receive the highest quality childcare & education.Kiddies Academy Lynnwood, Cura Avenue, Equestria, Pretoria, South Africa, South AfricaMonday7:00 am - 3:00 pmTuesday7:00 am - 3:00 pmWednesday7:00 am - 3:00 pmThursday7:00 am - 3:00 pmFriday7:00 am - 3:00 pmSaturdayClosedSundayClosed
							November 11, 2024 8:52 am local time","Kiddies Academy Lynnwood, Cura Avenue, Equestria, Pretoria, South Africa, South Africa"
Western Cape,Northern Suburbs,admin@holycross.co.za,,,https://saprivateschools.co.za/listing/holy-cross-sisters-pre-school/,IEB,,Western Cape,Grade RR,Grade R,7:00 am - 3:00 pm,"This school's description is currently being updated and will appear within the near future.Bloemhof Rd, Bloemhof, Cape Town, 7530, South Africa, South AfricaMonday7:00 am - 3:00 pmTuesday7:00 am - 3:00 pmWednesday7:00 am - 3:00 pmThursday7:00 am - 3:00 pmFriday7:00 am - 3:00 pmSaturdayClosedSundayClosed
							November 11, 2024 8:52 am local time","Bloemhof Rd, Bloemhof, Cape Town, 7530, South Africa, South Africa"
