Province,Town,Email,Phone,Website,Website1,Gender,Language,Curriculum,GradeMin,GradeMax,OpeningHours,Description,Address
Amanzimtoti,Kwazulu Natal,edukidztoti@gmail.com,,,https://saprivateschools.co.za/listing/edukidz-pre-pre-school/,CAPS,,Amanzimtoti,Grade RR,Grade R,7:00 am - 3:00 pm,"Edukidz Pre-School is located in Athlone Park, Amanzimtoti, and accommodates children from 15 months of age (providing that they can walk) up to 5 years of age. We do not accept any children with special educational needs. Edukidz is an establishment that is privately owned and owner-managed by an experienced and qualified teacher who holds an Honours Degree in Education with a specialization in Education Management. Edukidz offers a fun, safe, nurturing and structured learning environment that is beneficial to the early development of your child. Edukidz Pre-School is a sister school to Edukidz Pre-Primary School in Ladysmith, KZN that was established in 2001 and which has a firm reputation for excellence in education with over 150 young learners in attendance. ? See Amanzimtoti area on map to see other schools nearby.21 Heather Rd, Athlone Park, Amanzimtoti, 4126, South AfricaMonday7:00 am - 3:00 pmTuesday7:00 am - 3:00 pmWednesday7:00 am - 3:00 pmThursday7:00 am - 3:00 pmFriday7:00 am - 3:00 pmSaturdayClosedSundayClosed
							November 11, 2024 9:49 am local time","21 Heather Rd, Athlone Park, Amanzimtoti, 4126, South Africa"
Western Cape,Cape Town,valleykids@mweb.co.za,,,https://saprivateschools.co.za/listing/valley-pre-primary-pre-school/,CAPS,,Western Cape,Grade RR,Grade R,7:00 am - 3:30 pm,"Valley Pre-Primary is an independent school, registered by the Education Department. It offers an up-to-date school readiness programme, which also incorporates some ideas of Rudolph Steiner and Maria Montessori. Our staff of eight teachers are highly qualified and brings a variety of specialised qualifications to supplement the programme. They are supported by eight teaching assistants. The Governing Body (elected annually) liaises with its staff, parents and community to manage and administer the school. We aim to achieve excellence in education. Valley also offers an excellent aftercare facility. The programme is run by an experienced teacher and teaching assistants.4 Nerine St, Scott Estate, Cape Town, 7806, South AfricaMonday7:00 am - 3:30 pmTuesday7:00 am - 3:30 pmWednesday7:00 am - 3:30 pmThursday7:00 am - 3:30 pmFriday7:00 am - 3:30 pmSaturdayN/ASundayN/A
							November 11, 2024 9:49 am local time","4 Nerine St, Scott Estate, Cape Town, 7806, South Africa"
Western Cape,Cape Flats,info@cfce.org.za,,,https://saprivateschools.co.za/listing/zenzeleni-primary-school-for-creative-education/,English,Life Sciences,Mathematical Literacy,Physical Sciences,Afrikaans,7:00 am - 3:00 pm,"The Centre for Creative Education is an independent, non-profit, Waldorf-inspired institution based in Cape Town, South Africa. We seek to transform individuals and society by training teachers and performing artists, running a primary school in Khayelitsha, and lending support to over 25 schools in various ways. This happens locally and elsewhere in sub-Saharan Africa. We emphasize artistic creation as a central component of learning and health, and a means of profoundly engaging the liberal arts and sciences, social cohesion and well-rounded thinking. Mongesi Rd, Village 2 North, Cape Town, 7783, South AfricaMonday7:00 am - 3:00 pmTuesday7:00 am - 3:00 pmWednesday7:00 am - 3:00 pmThursday7:00 am - 3:00 pmFriday7:00 am - 3:00 pmSaturdayClosedSundayClosed
							November 11, 2024 9:49 am local time","Mongesi Rd, Village 2 North, Cape Town, 7783, South Africa"
Western Cape,Helderberg,contact.helderberg@iesmail.com,,,https://saprivateschools.co.za/listing/helderberg-international-high-school/,IEB,,Western Cape,Facebook,Twitter,7:00 am - 3:00 pm,"The International Education Systems group (IES) promotes the development of young people who will have the capacity to contribute proactively to the ongoing work towards a better world. Through dynamic programmes, IES will strive to develop leaders for the future who are collaborative, communicative, enquiring, respectful and creative individuals with a passion for lifelong learning. IES students will be encouraged to integrate effectively in the local, national and international communities through the diverse opportunities afforded to them. Early Childhood Curriculum Our 4 and 5 year-old students enjoy their first two years at IES International Helderberg School in a nurturing environment in a play-based, thematic curriculum designed to support children in all areas of their early development. Our Early Childhood teachers have small classes and enjoy the support of a qualified, full-time classroom assistant. Cambridge Primary International Curriculum IES International Helderberg School uses the Cambridge Primary International Examinations curriculum for English, Mathematics and Science and the South African, 'CAPS' (Curriculum and Assessment Policy Statements) as a guide for Afrikaans, History and Geography. Our philosophy of professional development as part of our teaching week and a deep understanding of international education underpins excellent classroom practice. Hazelden Dr, Heritage Park, Cape Town, 7130, South AfricaMonday7:00 am - 3:00 pmTuesday7:00 am - 3:00 pmWednesday7:00 am - 3:00 pmThursday7:00 am - 3:00 pmFriday7:00 am - 3:00 pmSaturdayClosedSundayClosed
							November 11, 2024 9:49 am local time","Hazelden Dr, Heritage Park, Cape Town, 7130, South Africa"
Eastern Cape,East London,aristonschool1@gmail.com,,,https://saprivateschools.co.za/listing/ariston-christian-primary-school/,IEB,,Eastern Cape,Instagram,YouTube,7:00 am - 3:00 pm,"The mission of the school is to pursue and maintain excellence in all spheres of school life, academic, athletic and cultural, within the South African community. It is the aim of the school to produce young men and women who are independent thinkers with physical and moral courage, who are articulate, well mannered and tolerant, educated in the widest sense of the word, sensitive to the needs of others, and dedicated to the service of their fellow men and women and the community as a whole. ? We are a private institution that offers quality education. We offer Play & Pre - School for ages 3 months & up, and Grades R to 9. MAIN CAMPUS: 12 St Matthews Road Belgravia East London 5201 PLAY & PRE-SCHOOL: 52 Belgravia Crescent Belgravia East London 5201 ? Ariston is a Christian, remedial school offering classes from grade R to grade 12, in Gonubie, East London. 12 St Matthews Rd, Belgravia, East London, 5201, South AfricaMonday7:00 am - 3:00 pmTuesday7:00 am - 3:00 pmWednesday7:00 am - 3:00 pmThursday7:00 am - 3:00 pmFriday7:00 am - 3:00 pmSaturdayClosedSundayClosed
							November 11, 2024 9:49 am local time","12 St Matthews Rd, Belgravia, East London, 5201, South Africa"
Gauteng,Sandton,marketing@redhill.co.za,,,https://saprivateschools.co.za/listing/redhill-primary-school/,Music,African Languages,Physical Sciences,Economics,Visual Arts,7:00 am - 3:00 pm,"Redhill School is an independent, co-educational, multi-faith school situated in Morningside, Johannesburg. Founded on a rich 108-year history and on the traditional values of academic excellence and diversity. Redhill has been and continues to be a leader amongst IEB schools in South Africa. We are proud to be recognised as a school that embraces the unique needs of pupils through a family-centred approach which aims to foster strong relationships between teachers, pupils and parents alike. This school/family partnership ensures positive educational and social outcomes for all pupils and contributes to the development of a warm and caring school community. Redhill is a combined school consisting of three phases that operate in close cooperation with one another to deliver a consistent learning environment that is in alignment with our core mission. The synergy that has been created between each school allows pupils to transition through each stage of the learning cycle easily and enables continuous improvement at all levels. ? See Morningside area on map to see other schools nearby.Redhill School, Summit Road, Morningside, Sandton, South Africa, South AfricaMonday7:00 am - 3:00 pmTuesday7:00 am - 3:00 pmWednesday7:00 am - 3:00 pmThursday7:00 am - 3:00 pmFriday7:00 am - 3:00 pmSaturdayClosedSundayClosed
							November 11, 2024 9:49 am local time","Redhill School, Summit Road, Morningside, Sandton, South Africa, South Africa"
Gauteng,Sandton,karel@chartwellcountrycollege.co.za,,,https://saprivateschools.co.za/listing/chartwell-country-pre-school/,IEB,,Gauteng,Grade RR,Grade R,7:00 am - 3:00 pm,"Chartwell Country College is founded on the basic belief that all individuals are unique. We believe that all children are capable of teaching as well as learning, and we take cognisance of this in all our interactions with our students. Our focus, therefore, is on developing the individual, not in moulding them into the strictures of conformity or the traditions of an institution, expecting them to perform in areas they are clearly not suited to. Too often we have seen the breakdown of a child's self-esteem, the labels that are attached and the medication unnecessarily administered to keep a child from disrupting a class environment unable to nurture and contain them. We at Chartwell have a group of highly professional and dedicated teachers to help ensure that all students receive the attention they need to fulfil their true potential. ?88 5th Street Chartwell, Chartwell, 2055, South AfricaMonday7:00 am - 3:00 pmTuesday7:00 am - 3:00 pmWednesday7:00 am - 3:00 pmThursday7:00 am - 3:00 pmFriday7:00 am - 3:00 pmSaturdayClosedSundayClosed
							November 11, 2024 9:49 am local time","88 5th Street Chartwell, Chartwell, 2055, South Africa"
Western Cape,Winelands,info@cleverheads.co.za,https://www.cleverheads.co.za/,,https://saprivateschools.co.za/listing/cleverheads-pre-primary-pre-school/,English,,Western Cape,Grade RR,Grade R,7:00 am - 3:00 pm,"Every child is unique and important and thus we strive to lay a solid foundation for the child's future. Learning Programmes and activities are planned in such a way to maximize the child's development. What a child thinks of him/herself influences everything they do; they need assurance that they are special and worthwhile as individuals. Education is a three-way process between the parent, teacher, and child: We, therefore, work closely with parents in the intellectual, emotional and social development of the child. Admissions Children between the ages of 18 months & 6 years shall be eligible for admission. On admission, the Application Form and supportive documents should be completed and signed by both parents/guardians. Admission shall be at the discretion of the school. Cleverheads is based in Somerset West.Follow us on Tick Tock - https://vm.tiktok.com/ZSeY3EPBd/32 Short St, Audas Estate, Cape Town, 7130, South AfricaMonday7:00 am - 3:00 pmTuesday7:00 am - 3:00 pmWednesday7:00 am - 3:00 pmThursday7:00 am - 3:00 pmFriday7:00 am - 3:00 pmSaturdayClosedSundayClosed
							November 11, 2024 9:49 am local time","32 Short St, Audas Estate, Cape Town, 7130, South Africa"
Amanzimtoti,Kwazulu Natal,admin@prescientprimary.co.za,,,https://saprivateschools.co.za/listing/prescient-primary-primary-school/,African Languages,Physical Sciences,Afrikaans,Visual Arts,Geography,7:00 am - 3:00 pm,"Prescient Primary is a private Christian school that offers an international, CAPS-aligned curriculum that educates learners academically, emotionally, and physically. We were formerly known as Cedar Hill Primary but have changed our brand since 2021. ? See Amanzimtoti area on map to see other schools nearby. Prescient Primary School, Bhengu Road, Amanzimtoti, South Africa, South AfricaMonday7:00 am - 3:00 pmTuesday7:00 am - 3:00 pmWednesday7:00 am - 3:00 pmThursday7:00 am - 3:00 pmFriday7:00 am - 3:00 pmSaturdayClosedSundayClosed
							November 11, 2024 9:49 am local time","Prescient Primary School, Bhengu Road, Amanzimtoti, South Africa, South Africa"
Gauteng,Randburg,info@northridingcollege.co.za,,,https://saprivateschools.co.za/listing/northriding-primary-school/,African Languages,Physical Sciences,Afrikaans,Visual Arts,Geography,7:00 am - 3:00 pm,"Providing affordable education in the heart of Northriding, in doing so we focus on teaching our students to find opportunity. We focus on academic development in our learners. Northriding College aims to provide a broad and well taught curriculum where the children have many wide and varied experiences. We encourage our children to do the best that they can focusing on all aspects of the children's development. We strive to create a safe and loving environment where children are able to achieve their full potential in all aspects of their learning. We will achieve this by creating a learning environment which is stimulating, challenging and enjoyable. We aim to promote a sense of belonging to our school and our community. See Randburg Schools Northriding College high school, Valley Road, North Riding AH, Randburg, South Africa, South AfricaMonday7:00 am - 3:00 pmTuesday7:00 am - 3:00 pmWednesday7:00 am - 3:00 pmThursday7:00 am - 3:00 pmFriday7:00 am - 3:00 pmSaturdayClosedSundayClosed
							November 11, 2024 9:49 am local time","Northriding College high school, Valley Road, North Riding AH, Randburg, South Africa, South Africa"
Gauteng,Gallo Manor,ruth@acornpreprimary.co.za,,,https://saprivateschools.co.za/listing/acorn-pre-primary/,CAPS,,Gauteng,Grade RR,Grade R,7:00 am - 3:00 pm,"Our educators are passionate about teaching. We encourage healthy eating with a well balanced diet. Our programmes aim at developing important skills. School shouldn't be a chore. It should be fun for all learners!14 Dahlia St, Gallo Manor, Gauteng, 2191, South AfricaMonday7:00 am - 3:00 pmTuesday7:00 am - 3:00 pmWednesday7:00 am - 3:00 pmThursday7:00 am - 3:00 pmFriday7:00 am - 3:00 pmSaturdayClosedSundayClosed
							November 11, 2024 9:49 am local time","14 Dahlia St, Gallo Manor, Gauteng, 2191, South Africa"
Kwazulu Natal,New Hanover,admin@newhanover.co.za,,,https://saprivateschools.co.za/listing/new-hanover-preparatory-pre-school/,CAPS,,Kwazulu Natal,Facebook,Twitter,7:00 am - 3:00 pm,"New Hanover Preparatory School is a co-educational Pre-Primary and Primary school, offering education in a country setting from Grade RRR to Grade 7. As the 6th oldest independent school in South Africa, New Hanover Prep is steeped in a rich heritage of 150 years of Christian-based education. With a strong core of values that include Christian Faith, a Sense of Self, Integrity and a Sense of Belonging, New Hanover Prep inspires learners to maximise their unique potential in a Christian environment. Dynamic facilitators develop essential foundational skills, thus enabling children to meet the challenges of the future. Set on a 14 hectare campus, just 35km from Pietermaritzburg our school overlooks the hills of the KZN Midlands. Within our small school environment, our children enjoy the benefits of vast sports fields, including a flood-lit field, tennis courts, netball courts, a networked computer centre, Audio-Visual room, library, outdoor pavilion, art room, aftercare, transport routes and so much more. Learning support is offered to children with special needs, while the curriculum caters for different learning styles.New Hanover Preparatory School, Dalton Rd, New Hanover, South Africa, South AfricaMonday7:00 am - 3:00 pmTuesday7:00 am - 3:00 pmWednesday7:00 am - 3:00 pmThursday7:00 am - 3:00 pmFriday7:00 am - 3:00 pmSaturdayClosedSundayClosed
							November 11, 2024 9:50 am local time","New Hanover Preparatory School, Dalton Rd, New Hanover, South Africa, South Africa"
Limpopo,Hoedspruit,marketing@scschools.co.za,,,https://saprivateschools.co.za/listing/southern-cross-high-schools/,CAPS,,Limpopo,Instagram,YouTube,7:00 am - 3:00 pm,"Southern Cross Schools is situated in a unique learning environment. Our deep rooted connection to the environment, coupled with outstanding IEB academic learning, supported by expert staff who are innately able to connect with learners and inspire individual potential, provides an education of choice. Located on a residential wildlife estate with over 1100 hectares of bushveld and plains game on the outskirts of the Greater Kruger National Park, our learners are afforded the opportunity to experience the environment on a personal level, encouraging them to acquire a genuine consciousness for the importance of sustainability on a global scale. ï£¿ With this foundation, we empower our learners with the tools they need to make a difference in our ever changing world. A celebration of diversity, progress and the power of collaboration, our learners emerge ready to lead and inspire change. ""We may not know exactly what lies ahead for our learners in the future, but we have the advantage of knowing many of the skills they will need once they get there.""Hoedspruit, 1380, South AfricaMonday7:00 am - 3:00 pmTuesday7:00 am - 3:00 pmWednesday7:00 am - 3:00 pmThursday7:00 am - 3:00 pmFriday7:00 am - 3:00 pmSaturdayClosedSundayClosed
							November 11, 2024 9:50 am local time","Hoedspruit, 1380, South Africa"