Province,Town,Email,Phone,Website,Website1,Gender,Language,Curriculum,GradeMin,GradeMax,OpeningHours,Description,Address
Western Cape,Hermanus,hermacademy@whalemail.co.za,,,https://saprivateschools.co.za/listing/hermanus-christian-academy-pre-school/,CAPS,,Western Cape,Facebook,Twitter,7:00 am - 3:00 pm,"Hermanus Christian Academy is a co-ed., primary school from grade 0 to grade 7. We are located in the suburb of sandbaai in hermanus. We use the accelerated christian education curriculum which, inter alia, teaches the pupil: to set goals, work at their own pace, be responsible and confident as they face the future. We are training children to represent Jesus Christ in their homes, schools and lives. For school fees or for other admissions information, please contact us below:1823 Bergsig St, Sandbaai, 7200, South AfricaMonday7:00 am - 3:00 pmTuesday7:00 am - 3:00 pmWednesday7:00 am - 3:00 pmThursday7:00 am - 3:00 pmFriday7:00 am - 3:00 pmSaturdayClosedSundayClosed
							November 11, 2024 9:47 am local time","1823 Bergsig St, Sandbaai, 7200, South Africa"
Kwazulu Natal,Pietermaritzburg,admin@maritzburgprep.co.za,,,https://saprivateschools.co.za/listing/maritzburg-preparatory-pre-school/,CAPS,,Kwazulu Natal,Facebook,Twitter,7:00 am - 3:00 pm,"This school started in 1989 on NCF Church campus. A group of intrepid church members felt that they needed to start a pre-school to serve the wider community of Pietermaritzburg. NCF Church embraced the idea of formal education on its land and endeavoured to assist. After 10 years of running a pre-school it was decided by Mrs W Fath (the first principal) to open a primary school. Since the first Grade 1 class of 1999 the school has experienced much positive growth. Mr B Mouton became the second principal in 2004. With a growing school and adjacent church it was decided to focus mainly on pre-school and junior primary from 2006. Since 2006 the focus of this school was to grow qualitatively and partner with neighbouring schools. Over the years the school added classrooms, sports fields and a swimming pool to its facilities. In June 2014 the school changed its name and badge, becoming Maritzburg Preparatory School. The school focuses on a qualitative approach to its foundation phase, and aims to be known for its love for children and its dedication as a team (staff, learners and parents) to giving the best all-round early education.Maritzburg Preparatory School, Alexandra Road, Westgate, Pietermaritzburg, South Africa, South AfricaMonday7:00 am - 3:00 pmTuesday7:00 am - 3:00 pmWednesday7:00 am - 3:00 pmThursday7:00 am - 3:00 pmFriday7:00 am - 3:00 pmSaturdayClosedSundayClosed
							November 11, 2024 9:47 am local time","Maritzburg Preparatory School, Alexandra Road, Westgate, Pietermaritzburg, South Africa, South Africa"
Gauteng,Sandton,info@kildrummyschool.co.za,,,https://saprivateschools.co.za/listing/kildrummy-pre-primary/,CAPS,,Gauteng,Grade RR,Grade R,7:00 am - 3:00 pm,"Welcome to Kildrummy Pre-Primary and Daycare At Kildrummy, we believe that children should learn through play, be involved, engaged and most importantly, do so in a safe, clean and nurturing environment. We offer an integrated curriculum for infants and young children from ages 3 months, to 6 years. Our mission is to create a happy, motivating and nurturing environment structured to encourage ""Learning through play"". Well qualified staff aim to ensure that development of the whole child - cognitively, physically, emotionally and socially - is implemented. Our vision is to ensure that children are empowered with life skills at an early age in order to become confident and successful in their adult lives. We are located in Paulshof, in a boomed area which provides the essential security for a safe educational environment, and we can accommodate children from all surrounding areas: Paulshof, Bryanston, Sunninghill, Lonehill, Petervale, Rivonia and Fourways.Kildrummy Pre Primary, Komari Avenue, Paulshof, Sandton, South Africa, South AfricaMonday7:00 am - 3:00 pmTuesday7:00 am - 3:00 pmWednesday7:00 am - 3:00 pmThursday7:00 am - 3:00 pmFriday7:00 am - 3:00 pmSaturdayClosedSundayClosed
							November 11, 2024 9:47 am local time","Kildrummy Pre Primary, Komari Avenue, Paulshof, Sandton, South Africa, South Africa"
Gauteng,Pretoria East,secretary@stalbanscollege.com,,,https://saprivateschools.co.za/listing/st-albans-college/,CAPS,,Gauteng,Facebook,Twitter,7:00 am - 3:00 pm,"Boys School St Alban's College is a young, vibrant Anglican boys' school, with Grades 8 to 12. It came into existence on 1 February 1963 with a total of 37 boys and a complement of 3 masters. We now number over 560 boys and over 60 teachers, plus an array of support staff. From its very inception it has been a school that loves a challenge. The founder-Headmaster, Anton Murray, was a South African cricketer who sought to maintain the best traditions of liberal education. So an emphasis on well-rounded development prevails, and games such as cricket, rugby and hockey have always figured prominently in our history. Our history of embracing diversity and making a difference in the broader community is also well established. Approaching our 50th anniversary in 2013, St Alban's College is established and secure but never complacent . See Lynnwood area on map to see other schools nearby.110 Clearwater Rd, Lynnwood Glen, Pretoria, 0081, South AfricaMonday7:00 am - 3:00 pmTuesday7:00 am - 3:00 pmWednesday7:00 am - 3:00 pmThursday7:00 am - 3:00 pmFriday7:00 am - 3:00 pmSaturdayClosedSundayClosed
							November 11, 2024 9:47 am local time","110 Clearwater Rd, Lynnwood Glen, Pretoria, 0081, South Africa"
Eastern Cape,Uitenhage,caledonprep@gmail.com,,,https://saprivateschools.co.za/listing/caledon-preparatory-pre-school/,CAPS,,Eastern Cape,Facebook,Twitter,7:00 am - 3:00 pm,"This school's description is currently being updated and will appear within the near future.7 High St, College Hill, Kariega, 6229, South AfricaMonday7:00 am - 3:00 pmTuesday7:00 am - 3:00 pmWednesday7:00 am - 3:00 pmThursday7:00 am - 3:00 pmFriday7:00 am - 3:00 pmSaturdayClosedSundayClosed
							November 11, 2024 9:47 am local time","7 High St, College Hill, Kariega, 6229, South Africa"
Gauteng,Roodepoort,info@childwise.co.za,,,https://saprivateschools.co.za/listing/child-wise-nursery-pre-school/,CAPS,,Gauteng,Grade RR,Grade R,7:00 am - 3:00 pm,"Welcome to Child Wise Nursery School We are a dual medium Christian based pre-school that caters for little ones from 1 Month up to Grade R. Child Wise's owner and staff are experienced, qualified individuals with a child first approach. We offer small classes, loving teachers and ample interaction. Child Wise focuses on individual attention for each child with a view to foster physical, social, emotional, intellectual and spiritual development providing a sound foundation for his/her future. We offer delicious and nutritious meals, all in a loving environment with a home away from home atmosphere. Because we value the safety and health of our learners, our staff are required to renew their CPR and First Aid training annually. School gates conveniently open at 06h00 in the morning for the early birds. The official school day will however begin at 08h00. The school closes at 18h00 in the afternoon and at 13h00 for half day learners. See Roodepoort area on map to see other schools nearby.65 Mimosa St, Helderkruin, Roodepoort, 1724, South AfricaMonday7:00 am - 3:00 pmTuesday7:00 am - 3:00 pmWednesday7:00 am - 3:00 pmThursday7:00 am - 3:00 pmFriday7:00 am - 3:00 pmSaturdayClosedSundayClosed
							November 11, 2024 9:47 am local time","65 Mimosa St, Helderkruin, Roodepoort, 1724, South Africa"
Western Cape,West Coast,principal.cst@gmail.com,,,https://saprivateschools.co.za/listing/cape-town-studies-private-high-school/,CAPS,,Western Cape,Facebook,Twitter,7:00 am - 3:00 pm,"We are a Grade 8 to 12 private school in Table View. We were founded in May 2004 after realising a great demand in our immediate community for education that meets the needs of the individual. We have created a secure environment conducive to bringing out the best in our learners through small classes and individual attention where needed. We are the proud recipients of a Dean's Honours Award from the EMS faculty at the University of the Western Cape, in recognition of the outstanding Academic Performance of some of our ex-learners over the recent years. One of our learners was the top student of 2009 and received the International Golden Key Award. We also received awards from the Western Cape Education Department in recognition of our pass rate as well as Academic Excellence.? 12B, 145 Blaauwberg Rd, Table View, Cape Town, 7441, South AfricaMonday7:00 am - 3:00 pmTuesday7:00 am - 3:00 pmWednesday7:00 am - 3:00 pmThursday7:00 am - 3:00 pmFriday7:00 am - 3:00 pmSaturdayClosedSundayClosed
							November 11, 2024 9:47 am local time","12B, 145 Blaauwberg Rd, Table View, Cape Town, 7441, South Africa"
Gauteng,East Rand,admin@dalparkprivate.co.za,,,https://saprivateschools.co.za/listing/dalpark-pre-school/,CAPS,,Gauteng,Grade RR,Grade R,7:00 am - 3:00 pm,"Dalpark Private School is an Independent Primary School that caters for learners from Grade R to Grade 7. The school boasts small classes (not exceeding 30 learners) and well-qualified teachers. Dalpark Private is not merely an educational institution; it is a warm, welcoming, comfortable, diversely rich place, which changes ""enough"" into ""more"", ""chaos"" into ""order"", ""confusion"" into ""clarity"", ""strangers"" into ""friends"" and much more. The Educators at this school have a great passion for what they do. They are of a high calibre and are always striving to achieve and improve and educate to the best of their ability. They are led by an extremely capable and actively involved management team whose aim is to create a, successful learning environment that showcases holistic development.Rangeview Rd, Leachville, Brakpan, 1553, South AfricaMonday7:00 am - 3:00 pmTuesday7:00 am - 3:00 pmWednesday7:00 am - 3:00 pmThursday7:00 am - 3:00 pmFriday7:00 am - 3:00 pmSaturdayClosedSundayClosed
							November 11, 2024 9:47 am local time","Rangeview Rd, Leachville, Brakpan, 1553, South Africa"
Gauteng,Kirkney,Admin.kirkney@acudeo.co.za,,,https://saprivateschools.co.za/listing/acudeo-college-kirkney/,CAPS,,Gauteng,Facebook,Twitter,7:00 am - 3:00 pm,"ACUDEO College is founded in the Christian faith and principles. ACUDEO is a composite word with the roots Acumen, the ability to think clearly, make good decisions and exercise sound judgement and Deo, which is Greek for God. The name Acudeo embodies growing one's knowledge and skills in the presence and under the guidance of God I am Emmanuel Ramathavha and I am very excited to be the founding Principal of ACUDEO College Kirkney. My passion is education and I have been involved in the profession for 14 years. I started out as a Physical Science teacher in rural Kwa-Zulu Natal (e-Nkandla) in 2003. As a young teacher the experience in KZN taught me to do more with less and to appreciate the power of education in changing lives and as a tool to develop our country. In 2009, I joined the Gauteng Department of Education at Eqinisweni Secondary in Ivory Park (one of the best performing high schools in the township). I served the school as a Physical Science educator and later Head of Department for Sciences. The experience presented me with an opportunity to join Mindset (DSTV channel 319) as a Physical Science tutor. Simonsberg Ave, Kirkney, Pretoria, 0182, South AfricaMonday7:00 am - 3:00 pmTuesday7:00 am - 3:00 pmWednesday7:00 am - 3:00 pmThursday7:00 am - 3:00 pmFriday7:00 am - 3:00 pmSaturdayClosedSundayClosed
							November 11, 2024 9:47 am local time","Simonsberg Ave, Kirkney, Pretoria, 0182, South Africa"
Nelspruit,Mbombela,admissions@penryn.co.za,,,https://saprivateschools.co.za/listing/penryn-pre-school/,CAPS,,Nelspruit,Grade RR,Grade R,7:00 am - 3:00 pm,"Penryn is situated in a stunning bushveld setting on the Boschrand Hills overlooking Nelspruit and the Crocodile River Valley. The College started as a twinning project with St Stithians College in Randburg with a view to establishing an institution in the Lowveld that would provide quality, holistic education in a Christian setting, and would partner schools in rural communities surrounding Nelspruit. Accordingly from a start in 1991 with 7 scholars in Gr 1, the College has grown to 1 000 co-educational scholars in 2010, and a community initiative called Penreach now partners over 2 000 teachers from partner schools each year in a rich and meaningful programme that continues to upgrade education in surrounding communities. ? See Nelspruit / Mbombela area on map to see other schools nearby.Penryn, Mbombela, South Africa, South AfricaMonday7:00 am - 3:00 pmTuesday7:00 am - 3:00 pmWednesday7:00 am - 3:00 pmThursday7:00 am - 3:00 pmFriday7:00 am - 3:00 pmSaturdayClosedSundayClosed
							November 11, 2024 9:47 am local time","Penryn, Mbombela, South Africa, South Africa"
Kwazulu Natal,Kokstad,PRO@stpatrickscollege.co.za,,,https://saprivateschools.co.za/listing/st-patricks-pre-school/,CAPS,,Kwazulu Natal,Facebook,Twitter,7:00 am - 3:00 pm,"St Patrick's College, as an Independent Christian School, is a mere eighteen years old but we can trace our service to the people of East Griqualand back to the eighteen nineties, when the Holy Cross Convent opened a primary school at the St Patrick's Roman Catholic Cathedral to serve the farming and trading community of the time. We have come a long way since then and now offer a holistic education to pupils from the age of three to nineteen, with the latter group writing the Independent Examinations Board National Senior Certificate.1 Crystal Springs Road, Kokstad, 4700, South AfricaMonday7:00 am - 3:00 pmTuesday7:00 am - 3:00 pmWednesday7:00 am - 3:00 pmThursday7:00 am - 3:00 pmFriday7:00 am - 3:00 pmSaturdayClosedSundayClosed
							November 11, 2024 9:47 am local time","1 Crystal Springs Road, Kokstad, 4700, South Africa"
Cape Town,Pinelands,info@graceprimary.org,,,https://saprivateschools.co.za/listing/grace-primary-pre-school/,CAPS,,Cape Town,Grade RR,Grade R,7:00 am - 3:00 pm,"Grace Primary School is a thriving young independent school in Pinelands with small classes, using a rich and stimulating literature-based curriculum. Grace Primary was established in January 2014 to provide high quality, affordable private schooling, based on Christian foundations, to Pinelands and the surrounding community. From 2019 we will have over 100 children in Grades 1-7 in 6 classes (Grades 6&7 in a joint class), with max 18 children in each class. We are due to build the final phase of our permanent premises in 2019. To find out more about us, please make an appointment to come and visit us. Protea Cl, Pinelands, Cape Town, 7405, South AfricaMonday7:00 am - 3:00 pmTuesday7:00 am - 3:00 pmWednesday7:00 am - 3:00 pmThursday7:00 am - 3:00 pmFriday7:00 am - 3:00 pmSaturdayClosedSundayClosed
							November 11, 2024 9:47 am local time","Protea Cl, Pinelands, Cape Town, 7405, South Africa"
Bedfordview,Gauteng,admissions@standrews.co.za,(011) 453 9408,https://www.standrews.co.za/,https://saprivateschools.co.za/listing/st-andrews-primary-school-for-girls/,Electrical Technology,Hospitality Studies,Mechanical Technology,Mathematics,Accounting,7:00 am - 3:00 pm,"St Andrew's School for Girls is a Christian school situated on the eastern side of Johannesburg in beautiful surroundings. The school offers a wealth of opportunities for young women to embrace. Our academic programme is challenging and imaginative, designed to foster intellectual curiosity and a lifelong love of learning. It is essential that all in our charge are equipped to take on the challenges of change and progress. Bus services are available on certain routes. Both the preschool and junior school offer aftercare facilities. Preschool We cater for boys and girls from three months to five years. Our groups are small and each child receives individual attention and plenty of love and care. There is a large, beautiful playground. We have a holistic approach to learning and aim to educate each child in all aspects of development - socially, emotionally physically, musically, creatively and linguistically. Junior School Our Junior School (grade 0 - 7) nestles against Gillooly's Hill. The girls learn in cheerful classrooms and spend their breaks and lunch times in beautiful gardens playing chess, chatting or using the playground equipment.St Andrews Ave, Senderwood, Germiston, 2145, South AfricaMonday7:00 am - 3:00 pmTuesday7:00 am - 3:00 pmWednesday7:00 am - 3:00 pmThursday7:00 am - 3:00 pmFriday7:00 am - 3:00 pmSaturdayClosedSundayClosed
							November 11, 2024 9:47 am local time","St Andrews Ave, Senderwood, Germiston, 2145, South Africa"
Eastern Cape,Thornhill,admissions@woodridge.co.za,,,https://saprivateschools.co.za/listing/woodridge-college/,CAPS,,Eastern Cape,Instagram,YouTube,7:00 am - 3:00 pm,"Woodridge College & Preparatory School is a prestigious co-ed boarding school , located on a magnificent 365-acre estate, in the Eastern Cape countryside. ? Among the top reasons why current parents have chosen Woodridge as their school of choice are: ISASA school, following IEB curriculum; Smaller classes, academic support & individual attention; Safe & secure environment; Outdoor education & location of the school in a multi-adventure setting in nature; Christian values & holistic educational philosophy, caring for the mind, body & spirit of the individual; Array of music & cultural activities; and Variety of extra-murals, including unique activities like surf-lifesaving and horse-riding. ? We are proudly associated with ISASA. This translates into the following benefits for parents: Safe, structured, nurturing learning environments with good discipline, sound values and pastoral care. High academic standards as ISASA schools strive to provide an excellent, world class education that focuses on developing high-level competencies in languages, mathematics, science and technology, as well as critical thinking, problem-solving and teamwork skills. Freedom to introduce innovative approaches to teaching and learning and develop and test new educational concepts. Committed, high-quality teachers with strong subject knowledge. Old Van Stadens Pass Road Thornhill, 6375, South AfricaMonday7:00 am - 3:00 pmTuesday7:00 am - 3:00 pmWednesday7:00 am - 3:00 pmThursday7:00 am - 3:00 pmFriday7:00 am - 3:00 pmSaturdayClosedSundayClosed
							November 11, 2024 9:48 am local time","Old Van Stadens Pass Road Thornhill, 6375, South Africa"
Eldoraigne,Gauteng,opti-baby-weirda-park@saprivateschools.co.za,,,https://saprivateschools.co.za/listing/opti-baby-kids-weirda-park-pre-school/,CAPS,,Eldoraigne,Grade RR,Grade R,7:00 am - 3:00 pm,"At Opti-Baby & Kids we create a place of wellbeing and joy - to bring parents like you the enormous comfort that comes with knowing your little one is cared for and thriving. These are our philosophies and values that shape Opti-Baby & Kids experiences and set us apart from other day-care centres. Developing 21st century children with the skills to cope in an ever changing world. To offer a premium, national infant and ECD learning experience through: Dedicated staff who applyÂ inspired effortsÂ to grow young minds and bodies; Parental partnership to foster anÂ extended-family environmentÂ for your child; and AÂ best-in-classÂ curriculum Our Core Values - The WHY concept: Safety and Security Caring, loving and nurturing Innovation Learning through fun and play Continuous development Educationally relevant Professionalism A partner in parentingOpti-Baby & Kids, Tyrwhitt Avenue, Melrose, Johannesburg, South Africa, South AfricaMonday7:00 am - 3:00 pmTuesday7:00 am - 3:00 pmWednesday7:00 am - 3:00 pmThursday7:00 am - 3:00 pmFriday7:00 am - 3:00 pmSaturdayClosedSundayClosed
							November 11, 2024 9:48 am local time","Opti-Baby & Kids, Tyrwhitt Avenue, Melrose, Johannesburg, South Africa, South Africa"
Western Cape,Knysna,knysnaeducation@gmail.com,,,https://saprivateschools.co.za/listing/keurbosch-pre-school/,CAPS,,Western Cape,Facebook,Twitter,7:00 am - 3:00 pm,"Vision To see our students inspired and happy in a nurtured, safe, secure and welcoming environment while studying the International Cambridge Curriculum. Mission To apply proven as well as innovative methods in our teaching methodology to equip our students for a successful future. Cambridge Using a Cambridge International curriculum helps students to become confident, responsible, reflective, innovative and engaged. Technology Students learn how to apply technology in a meaningful and real way. Care We deeply care for each and every student and who they will become. Teaching We make use of technology and different teaching methods to make classes interactive and memorable. Students have access to lesson materials online, along with their in-class lessons. This combination ensures that students learn for mastery.34 Queen Street, Belvidere Estate, Knysna, 6571, South Africa, South AfricaMonday7:00 am - 3:00 pmTuesday7:00 am - 3:00 pmWednesday7:00 am - 3:00 pmThursday7:00 am - 3:00 pmFriday7:00 am - 3:00 pmSaturdayClosedSundayClosed
							November 11, 2024 9:48 am local time","34 Queen Street, Belvidere Estate, Knysna, 6571, South Africa, South Africa"
Gauteng,Krugersdorp,admin@azms.co.za,,,https://saprivateschools.co.za/listing/azaadville-muslim-primary-school/,Tourism,Economics,Visual Arts,Consumer Studies,Agricultural technology,7:00 am - 3:00 pm,"This school's description is currently being updated and will appear within the near future.11 Medina St, Azaadville, Krugersdorp, 1754, South AfricaMonday7:00 am - 3:00 pmTuesday7:00 am - 3:00 pmWednesday7:00 am - 3:00 pmThursday7:00 am - 3:00 pmFriday7:00 am - 3:00 pmSaturdayClosedSundayClosed
							November 11, 2024 9:48 am local time","11 Medina St, Azaadville, Krugersdorp, 1754, South Africa"
Limpopo,Makwarela,info@tshikevha.co.za,,,https://saprivateschools.co.za/listing/tshikevha-christian-high-school/,CAPS,,Limpopo,Facebook,Twitter,7:00 am - 3:00 pm,"Tshikevha Christian School was established in 1986 in Venda, Limpopo Province in South Africa. The school was established at the initiative of parents of the Reformed Churches in Venda concerned with the level of education and the moral of educators in general together with Dutch missionaries sent to Venda by the Christian Reformed Churches in the Netherlands. The aim to establish the school was to pursue Christian education where children of Christian parents could be taught and raised in the fear of the Lord. The school also plays a mission role in that we also admit children with no Christian background who get introduced to Christianity for the first time in the school. Children enrolled in our school are taught from the earliest stages of their lives that everything they are taught, and learn at school is what God created and that apart from Gods creation there is absolutely nothing to teach and to learn. The school achieves excellent grade 12 results every year, including 100% pass for the past three years. Makwarela, Thohoyandou, 0950, South AfricaMonday7:00 am - 3:00 pmTuesday7:00 am - 3:00 pmWednesday7:00 am - 3:00 pmThursday7:00 am - 3:00 pmFriday7:00 am - 3:00 pmSaturdayClosedSundayClosed
							November 11, 2024 9:48 am local time","Makwarela, Thohoyandou, 0950, South Africa"
Mpumalanga,Nelspruit,happyfeetnurseryschool@yahoo.co.za,,,https://saprivateschools.co.za/listing/happy-feet-nursery-pre-school/,CAPS,,Mpumalanga,Facebook,Twitter,7:00 am - 3:00 pm,"Happy Feet Nursery School, White River, is a pre-school which started dominating the pre-schools arena in White River and the surrounding communities soon after it was started in 2015. It is a school where the children always look forward to going each and every day, but that is not the end of the story: parents too take much pleasure and pride in dropping their little ones to the school each morning. It is so amazing to find children from different backgrounds co-existing together with common purpose and unity in happiness. Yes, Happy Feet! The interest and confidence of the parents is clearly evident during the annual concert show. It feels like if you do not have your kids at Happy Feet, then you are missing out big time! The progress and development being experienced at Happy Feet is so phenomenal, and the credit goes to all involved: learners, teachers, parents and the school community. See Nelspruit / Mbombela area on map to see other schools nearby.20 Ruimsig Rd, Kingsview, White River, 1240Monday7:00 am - 3:00 pmTuesday7:00 am - 3:00 pmWednesday7:00 am - 3:00 pmThursday7:00 am - 3:00 pmFriday7:00 am - 3:00 pmSaturdayClosedSundayClosed
							November 11, 2024 9:48 am local time","20 Ruimsig Rd, Kingsview, White River, 1240"
