Province,Town,Email,Phone,Website,Website1,Gender,Language,Curriculum,GradeMin,GradeMax,OpeningHours,Description,Address
Eastern Cape,Port Elizabeth,info@gatewayspre.com,,,https://saprivateschools.co.za/listing/gateways-preprimary-pre-school/,CAPS,,Eastern Cape,Grade RR,Grade R,7:00 am - 3:00 pm,"Our little school has a long history in the Walmer area and continues to offer a high standard of education to the children in our community. We aim to create a safe and enriched environment in which children feel respected, encouraged to learn, offered opportunities to gain independence and express themselves. Our children are offered a wide variety of creative and educational learning opportunities through play and exploration, which builds their basic concepts in mathematics, language and life skills. The learning programmes are based on the CAPS Curriculum and Assessment Policy Statements as prescribed by the Department of Education. We aim to nurture, encourage and inspire our children to explore and learn from the world around them. Our dedicated, caring and qualified teachers lead by example as life-long-learners and continue to develop their teaching skills and strategies through training to best serve our children. See Port Elizabeth Schools 56 Main Rd, Walmer, Gqeberha, 6065, South AfricaMonday7:00 am - 3:00 pmTuesday7:00 am - 3:00 pmWednesday7:00 am - 3:00 pmThursday7:00 am - 3:00 pmFriday7:00 am - 3:00 pmSaturdayClosedSundayClosed
							November 11, 2024 8:50 am local time","56 Main Rd, Walmer, Gqeberha, 6065, South Africa"
Gauteng,Johannesburg,secretaryone@libertycollege.co.za,,,https://saprivateschools.co.za/listing/liberty-pre-school/,CAPS,,Gauteng,Grade RR,Grade R,7:00 am - 3:00 pm,"We believe that learners are unique and independent human beings. They are a work in progress. As such they have greatest likelihoods of reaching their full potential if they receive the necessary and relevant support. Universal inclusivity, in a school context, demands that we reach out and care for all who experience academic circumstances of any kind and that has never escaped our attention. 2 10th Rd, Bramley, Johannesburg, 2018, South AfricaMonday7:00 am - 3:00 pmTuesday7:00 am - 3:00 pmWednesday7:00 am - 3:00 pmThursday7:00 am - 3:00 pmFriday7:00 am - 3:00 pmSaturdayClosedSundayClosed
							November 11, 2024 8:50 am local time","2 10th Rd, Bramley, Johannesburg, 2018, South Africa"
Western Cape,Cape Town,ecole@efdc.co.za,,,https://saprivateschools.co.za/listing/cape-town-french-high-school/,IEB,,Western Cape,Instagram,YouTube,7:00 am - 3:00 pm,"The French School of Cape Town seeks to provide each student with a broad and strongly-built education in a safe and supportive multicultural environment. We are dedicated to helping all our students become independent and respectful young adults with an aim towards achievement. ? Kings Rd, Sea Point, Cape Town, 8060, South AfricaMonday7:00 am - 3:00 pmTuesday7:00 am - 3:00 pmWednesday7:00 am - 3:00 pmThursday7:00 am - 3:00 pmFriday7:00 am - 3:00 pmSaturdayClosedSundayClosed
							November 11, 2024 8:50 am local time","Kings Rd, Sea Point, Cape Town, 8060, South Africa"
Mahushu,Mpumalanga,bundeneinvestements@gmail.com,,,https://saprivateschools.co.za/listing/elephant-private-college/,CAPS,,Mahushu,Facebook,Twitter,7:00 am - 3:00 pm,"Elephant Private School is an independent secondary school located at 3 Mahushu Trust, Hazyview, Hazyview, 1242 in Mpumalanga Province, South Africa. The School's post office box number is at Po Box 15645 White River 1240. Elephant Private School is an ordinary school specializing in ordinary subjects. Stand number 3, Mahushu Trust, Hazyview, 1242, South AfricaMonday7:00 am - 3:00 pmTuesday7:00 am - 3:00 pmWednesday7:00 am - 3:00 pmThursday7:00 am - 3:00 pmFriday7:00 am - 3:00 pmSaturdayClosedSundayClosed
							November 11, 2024 8:50 am local time","Stand number 3, Mahushu Trust, Hazyview, 1242, South Africa"
Lanseria,Gauteng,blairathollschool@zamail.co.za,,,https://saprivateschools.co.za/listing/blair-atholl-primary-school/,Tourism,Economics,Visual Arts,Consumer Studies,Agricultural technology,7:00 am - 3:00 pm,"The Blair Atholl Schools are situated in the Lanseria area, north of Johannesburg and provide quality education to the learners of this marginalised community. Blair Atholl Primary School, which is state funded with some additional funding from the pre-school, provides education to some 480 learners from grade 1-7. While the Pre-school, relies totally on private funding and caters for 100 learners from the ages of 3-7. The pre-school has been in operation for 19 years now and as there are very few other pre-schools in the area, it is vital that the children from the surrounding impoverished communities receive some stimulation and education in preparation for their entry into formal schooling. The Blair Atholl Schools offer a unique educational opportunity which goes beyond the four walls of the classroom, providing the children with a stimulating and diversified programme that incorporates sports and cultural activities, including a music centre, library and small computer centre. The pre-school also offers a feeding scheme to its learners, which provides the children with two meals a day.Portion 90 Farm Lindley Corner of R512 (Malibongwe) & Kromdraai Lanseria, South AfricaPortion 90 Farm Lindley Corner of R512 (Malibongwe) & Kromdraai Lanseria, South AfricaMonday7:00 am - 3:00 pmTuesday7:00 am - 3:00 pmWednesday7:00 am - 3:00 pmThursday7:00 am - 3:00 pmFriday7:00 am - 3:00 pmSaturdayClosedSundayClosed
							November 11, 2024 8:50 am local time","Portion 90 Farm Lindley Corner of R512 (Malibongwe) & Kromdraai Lanseria, South Africa"
Gauteng,Roodepoort,info@sparkschools.co.za,,,https://saprivateschools.co.za/listing/spark-weltevreden-park-primary-school/,Accounting,Music,African Languages,Tourism,Economics,7:00 am - 3:00 pm,"SPARK Weltevreden Park opened January 2019 and is the eighteenth school in the SPARK Schools network. SPARK Weltevreden Park is located in the West of Johannesburg. SPARK Schools grow by a grade each year, we offer Grades R â€“ 7 school offering.Corner Albert Street &, Cornelius St, Weltevredenpark, 1709, South AfricaMonday7:00 am - 3:00 pmTuesday7:00 am - 3:00 pmWednesday7:00 am - 3:00 pmThursday7:00 am - 3:00 pmFriday7:00 am - 3:00 pmSaturdayClosedSundayClosed
							November 11, 2024 8:50 am local time","Corner Albert Street &, Cornelius St, Weltevredenpark, 1709, South Africa"
Gauteng,Jhb East,shangria@mweb.co.za,,,https://saprivateschools.co.za/listing/shangri-la-academy-high-school/,CAPS,,Gauteng,Facebook,Twitter,7:00 am - 3:00 pm,"Day students only Girls and Boys Combined School: Gr R (6yrs) - Matric Independent Examination Board Number of pupils: 615. ? ? See Kempton Park area on map to see other schools nearby.Shangri-La Academy, Fiskaal Street, Glen marais, Kempton Park, South Africa, South AfricaMonday7:00 am - 3:00 pmTuesday7:00 am - 3:00 pmWednesday7:00 am - 3:00 pmThursday7:00 am - 3:00 pmFriday7:00 am - 3:00 pmSaturdayClosedSundayClosed
							November 11, 2024 8:50 am local time","Shangri-La Academy, Fiskaal Street, Glen marais, Kempton Park, South Africa, South Africa"
Cape Town,Kenilworth,info@squirrelsleap.co.za,,,https://saprivateschools.co.za/listing/squirrels-leap-play-pre-school/,CAPS,,Cape Town,Grade RR,Grade R,7:00 am - 3:00 pm,"Our teaching philosophy A large part of our teaching choices and principles are Montessori based, this leads to a system of education which is both a philosophy of child development and a motivation for guiding such growth. It is based on two important developmental needs of children: The need for freedom within limits. A carefully prepared environment which guarantees exposure to materials and experiences. This system of education is designed to take full advantage of the child's desire to learn and use his or her unique ability to develop their own capabilities. Our learning environment will help the child to develop physically, cognitively, socially and emotionally. Children choose their activities from open shelves with self-correcting materials and work in distinct work areas - on tables or on rugs on the floor. The practical life exercises enhance the development of task organization and cognitive order through care of self, care of the environment, exercises of grace and courtesy, and refinement of physical movement. The sensorial materials enable the child to order, classify and describe sensory impressions in relation, length, width, temperature, mass and colour.61 Bathurst Rd, Kenilworth, Cape Town, 7708, South AfricaMonday7:00 am - 3:00 pmTuesday7:00 am - 3:00 pmWednesday7:00 am - 3:00 pmThursday7:00 am - 3:00 pmFriday7:00 am - 3:00 pmSaturdayClosedSundayClosed
							November 11, 2024 8:50 am local time","61 Bathurst Rd, Kenilworth, Cape Town, 7708, South Africa"
Eastern Cape,Port Elizabeth,chris@urbanacademy.co.za,,,https://saprivateschools.co.za/listing/urban-academy-high-school/,IEB,,Eastern Cape,Instagram,YouTube,7:00 am - 3:00 pm,"We would like to welcome all new students to Urban Academy. Be assured that you have made the right choice. Urban Academy is not just another school - it is the school where you will get the opportunity to excel and achieve your potential. We pride ourselves of being caring and able, and will at all times focus on the improvement of your educational outcome. We will do our utmost to live up to the values and standards we set for ourselves. We would like all to feel welcome and at home at all times. Make this your home and be part of our family. While at school we as the staff of Urban Academy will always act in a responsible way and take care of all students as if they are our own. ? ? See Port Elizabeth area on map to see other schools nearby. 272 Govan Mbeki St, Port Elizabeth Central, Gqeberha, 6001, South AfricaMonday7:00 am - 3:00 pmTuesday7:00 am - 3:00 pmWednesday7:00 am - 3:00 pmThursday7:00 am - 3:00 pmFriday7:00 am - 3:00 pmSaturdayClosedSundayClosed
							November 11, 2024 8:50 am local time","272 Govan Mbeki St, Port Elizabeth Central, Gqeberha, 6001, South Africa"
Brackenhurst,Gauteng,graceaftercare@gmail.com,,,https://saprivateschools.co.za/listing/rainbow-kidz-academy-and-aftercare-pre-school/,CAPS,,Brackenhurst,Grade RR,Grade R,7:00 am - 3:00 pm,"Rainbow Kidz Academy and Aftercare is a private Pre-Primary school/ Baby Academy and Aftercare facility based in Brackenhurst - Alberton. Here we strive to give the best possible educational assistance, learning support and loving interactive environment. We are open Mondays to Fridays from 06h30 to 18h00(During the summer time) and 06h30 to 17h45(During wintertime). The school is based and runs on a very Holistic approach with emphasis on developing the overall child as a whole: Emotionally, Socially, Physically, Academically and Spiritually. We also ensure that children are educated in a Christian environment. We strive to offer the very BEST facilities, equipment, care and services to our children and our parents. ? We pride ourselves in always ensuring our children's needs are put first and we strive to constantly grow and improve on every aspect of the running of our schools. We make use of an educational program that has been developed by qualified nursery school teachers that ensures that the relevant topics and learning is acquired in order to get children ready for primary school.Rainbow Kidz Academy, Pieter Street, Brackenhurst, Alberton, South Africa, South AfricaMonday7:00 am - 3:00 pmTuesday7:00 am - 3:00 pmWednesday7:00 am - 3:00 pmThursday7:00 am - 3:00 pmFriday7:00 am - 3:00 pmSaturdayClosedSundayClosed
							November 11, 2024 8:50 am local time","Rainbow Kidz Academy, Pieter Street, Brackenhurst, Alberton, South Africa, South Africa"
Kwazulu Natal,Durban,info@dsdurban.co.za,,,https://saprivateschools.co.za/listing/deutche-schule-durban-primary-school/,IEB,,Kwazulu Natal,Facebook,Twitter,7:00 am - 3:00 pm,"The Deutsche Schule Durban is an independent German school that is situated in beautiful grounds and buildings in Cowies Hill and offers a holistic education for children between the ages of 18 Months and 13 years, from Kindergarten to Grade 7. Established in 1971, the DSD is affiliated to the Independent Schools Association of Southern Africa (ISASA). In an increasingly globalised world, there are more and more non-German-speaking families choosing to give their child the benefit of German as an additional language. At present there are approximately 150 pupils in our school and the school has developed into a well-known educational institution in the Durban area, with top local high schools eagerly wishing to recruit its Grade 7 school leavers. From grade 8 onwards, the DSD continues to offer German as a subject to its alumni and helps them to prepare for the German Language Certificate exams. ? All lessons from Kindergarten to Grade 4 are taught in German, and from Grade 5 lessons are conducted in English but with German offered as a compulsory subject at first language level.34 Stafford Rd, Woodside, Westville, 3630, South AfricaMonday7:00 am - 3:00 pmTuesday7:00 am - 3:00 pmWednesday7:00 am - 3:00 pmThursday7:00 am - 3:00 pmFriday7:00 am - 3:00 pmSaturdayClosedSundayClosed
							November 11, 2024 8:50 am local time","34 Stafford Rd, Woodside, Westville, 3630, South Africa"
Gauteng,Sandton,admin@kidsinternational.co.za,,,https://saprivateschools.co.za/listing/kim-field-academy-pre-school/,CAPS,,Gauteng,Grade RR,Grade R,7:00 am - 3:00 pm,"Welcome to the Kim Field Academy. Comprised of three divisions, each offering uncompromising levels of excellence we believe in putting the interest of your child first above all else. By constantly improving on our facilities and adapting our environment to global trends, your child will grow into a self-assured confident individual. Centrally situated in the heart of Fourways, Johannesburg we are well located between suburbs including Lonehill, Dainfern, Broadacres, Craigavon and Magaliessig. Kim Field Academy Private Primary School Education: Kim Field Academy Private Primary Education is an initiative to combine high quality primary education with the development of arts and culture. With small classes of no more than 15 pupils we ensure your child receives individual attention from our qualified teachers whilst our brand new CAPS curriculum keeps your child at the leading edge of current educational standards. As part of your child's education he/ she will also receive expert tutoring in the arts including all forms of dancing, musical instruments, vocal coaching and stage performance making this the first primary education facility of its kind in South Africa. To top it off, we offer this outstanding level of education at a very reasonable cost to you as parent.Kim Field Academy, Kingfisher Drive, Fourways, Sandton, South Africa, South AfricaMonday7:00 am - 3:00 pmTuesday7:00 am - 3:00 pmWednesday7:00 am - 3:00 pmThursday7:00 am - 3:00 pmFriday7:00 am - 3:00 pmSaturdayClosedSundayClosed
							November 11, 2024 8:50 am local time","Kim Field Academy, Kingfisher Drive, Fourways, Sandton, South Africa, South Africa"
Gauteng,Centurion,info@pvrca.co.za,,,https://saprivateschools.co.za/listing/pierre-van-ryneveld-christian-academy-pre-school/,Afrikaans,Dual-Medium,IEB,Grade RR,Grade R,7:00 am - 3:00 pm,"We are a non-racial, church-based, Christian School with a mission to serve the families of our school. Our objective is to provide a Christ-centred, Bible-based excellent academic education, which will equip students with Christian character and life skills to enable them to fulfill their God appointed potential in adult life. It is our mission to Teach children to read for knowledge Teach them to study for understanding Build their characters See Centurion SchoolsPierre Van Ryneveld Christian School, Spitfire Avenue, Pierre van Ryneveld Park, Centurion, South Africa, South AfricaMonday7:00 am - 3:00 pmTuesday7:00 am - 3:00 pmWednesday7:00 am - 3:00 pmThursday7:00 am - 3:00 pmFriday7:00 am - 3:00 pmSaturdayClosedSundayClosed
							November 11, 2024 8:50 am local time","Pierre Van Ryneveld Christian School, Spitfire Avenue, Pierre van Ryneveld Park, Centurion, South Africa, South Africa"
Western Cape,Helderberg,principal@vergezicht.co.za,,,https://saprivateschools.co.za/listing/vergezicht-private-primary-school/,Visual Arts,Geography,Agricultural Management Practices,Dance Studies,Civil Technology,7:00 am - 3:00 pm,"Vergezicht Private School in Somerset West, creates a learning support milieu to learners who may find it difficult to adapt and flourish in big schools. Vergezicht Private School offers Afrikaans and English speaking pupils a remedial environment in which everyone is encouraged to achieve their potential. We teach learners from Grade R to Grade 7 and are ideally suited for children with ADHD, barriers to learning and those who need the emotional security of small classes. Vergezicht Private School, registered with the WCED, has small classes with an average of 11 learners per class. See Somerset West area on map to see other schools nearby.Prospect House, Morkel St, Somerset West, Cape Town, 7130, South AfricaMonday7:00 am - 3:00 pmTuesday7:00 am - 3:00 pmWednesday7:00 am - 3:00 pmThursday7:00 am - 3:00 pmFriday7:00 am - 3:00 pmSaturdayClosedSundayClosed
							November 11, 2024 8:50 am local time","Prospect House, Morkel St, Somerset West, Cape Town, 7130, South Africa"
Gauteng,Randburg,info@fairmontacademy.co.za,,,https://saprivateschools.co.za/listing/fairmont-academy-primary-school/,Music,African Languages,Physical Sciences,Economics,Visual Arts,7:00 am - 3:00 pm,"We are an institution of excellence but we do not want to promote elitism. With elitism you exclude and as a community school we embrace all differences. By exposing our learners, parents and staff to diversity, we develop a balanced and caring school as well as individuals who will be an asset to our country.67 Kessel St, Fairland, Randburg, 2030, South AfricaMonday7:00 am - 3:00 pmTuesday7:00 am - 3:00 pmWednesday7:00 am - 3:00 pmThursday7:00 am - 3:00 pmFriday7:00 am - 3:00 pmSaturdayClosedSundayClosed
							November 11, 2024 8:50 am local time","67 Kessel St, Fairland, Randburg, 2030, South Africa"
Western Cape,Northern Suburbs,admissions@escs.org.za,219 751 980,www.escs.org.za,https://saprivateschools.co.za/listing/el-shaddai-christian-high-school/,Chess,Cricket,Cross-Country,Debating,Drama,7:00 am - 3:00 pm,"Established in 1993 by El Shaddai Christian Church, the El Shaddai Christian School is an independent, co-educational, Christian School situated amongst the rolling hills of the beautiful green suburb of Durbanville, in Cape Town, South Africa.At El Shaddai Christian School you will discover a dynamic community of faith, engaging in a variety of ventures as we disciple precious Grade 00-12 image bearers. In our pursuit of an abundant, flourishing life, we leave no stone unturned as we educate the mind, train the heart, and form strong bonds of friendship. As followers of Christ we create culture and play sport, reach out through acts of service and eagerly learn how to live confidently and faithfully in the 21st century, leaving a legacy far beyond.There are few things in the world we cherish more than to grow, equip and send. To us it is more than a motto. Discipleship drives our mission, refocuses our vision and defines our values.We want to deliberately disciple students in order for them to grow in their individual identity in Christ as we develop their character.It is essential for us to equip them with a solid academic foundation on which we can build to develop the whole person. We create opportunities so that every student can be equipped with and practice essential 21st Century skills through various vehicles.We nurture their gifting in order for us to send them out as salt and light into all domains of society to advance God’s Kingdom by beingAuthentic Agents of ReconciliationCompassionate LeadersDiligent StewardsDiscerning CommunicatorsEthical InfluencersInnovative Problem-solvers ...and much more.We are simply revitalised by the task at hand and would be thrilled if you visit our website (https://escs.org.za/) to learn more about us.In our High School, we aspire to shape confident and responsible students as they pursue excellence in academics to fulfil their God-given purpose in society. The Junior High School Phase follows an enriched national curriculum exposing students to a wide range of subjects and skills in preparation for the Cambridge Assessment International Curriculum in the Senior High School Phase. The internationally benchmarked Cambridge curriculum encourages reflective, innovative and engaged students who can meet the demands of a changing world. The Cambridge IGCSE and AS Level courses in Grades 10 to 12 ensure that our Matrics’ qualifications are accepted for University and College entry, as well as for employment purposes globally. In addition, our Biblical integration ensures that students engage with the content in a meaningful way as they are being equipped to be ethical influencers in society.Culture Expressions create safe opportunities where students can enjoy themselves and flourish while being equipped with essential skills that will allow them to be Culture Creators in the 21st Century. Students will find that our clubs are meaningful and give them a sense of belonging where they can be bold and brave, as well as provide fantastic opportunities to build lasting friendships with others around common interests. Clubs include Event Expression; Media Expressions; Production Crew; Performing Expressions with Drama, Dancing and Singing and the Sanctified Worship band; Life Expressions with public speaking, debating , chess , eco club and EisteddfodThe Sport Department seeks to improve the physical and emotional health of our students through participation in both competitive and recreational sports in a safe environment. In addition, we strive to use sport as a vehicle for discipling, camaraderie and relationship building. In all sporting codes, character qualities are key values that are emphasised regularly. During competitive events outside of school we place high value on the opportunity to live out our testimony. Sporting codes: Athletics; Swimming; Hockey; Netball; SquashSchool Life seeks to ensure that the participation at school events and connection between students cultivates the overall well-being of the individual. The Grade 12 Leadership Team runs events that encourage cross-grade and cross-school interaction in order to create an atmosphere of camaraderie and unity. Students express their creativity, enlarge their friendship circles and learn in an environment that goes beyond the classroom or extracurricular programme. Student-led events inspire collaboration and provide students with opportunities to exercise their leadership skills while implementing their unique vision for the year. It is invigorating witnessing students living life to the full. Activities include: Interschools’ cheerleading, camps, assemblies, termly events that encourage wider school community interaction, Appreciation Day and other themed civvies days, trading days, grade socials, High School dances, Founders’ Day celebrations, and the like.Headmaster,Mr Siebert J. Myburgh6 Langeberg Rd, Durbanville, Cape Town, 7550, South AfricaMonday7:00 am - 3:00 pmTuesday7:00 am - 3:00 pmWednesday7:00 am - 3:00 pmThursday7:00 am - 3:00 pmFriday7:00 am - 3:00 pmSaturdayClosedSundayClosed
							November 11, 2024 8:50 am local time","6 Langeberg Rd, Durbanville, Cape Town, 7550, South Africa"
Kwazulu Natal,Kwambonambi,info.grantleigh@curro.co.za,,,https://saprivateschools.co.za/listing/grantleigh-high-school/,CAPS,,Kwazulu Natal,Instagram,YouTube,7:00 am - 3:00 pm,"This school's description is currently being updated and will appear within the near future.District Road P386 Mposa, 3915, South AfricaMonday7:00 am - 3:00 pmTuesday7:00 am - 3:00 pmWednesday7:00 am - 3:00 pmThursday7:00 am - 3:00 pmFriday7:00 am - 3:00 pmSaturdayClosedSundayClosed
							November 11, 2024 8:50 am local time","District Road P386 Mposa, 3915, South Africa"
