Province,Town,Email,Phone,Website,Website1,Gender,Language,Curriculum,GradeMin,GradeMax,OpeningHours,Description,Address
Gauteng,Pretoria East,admin@tygervalleycollege.co.za,,,https://saprivateschools.co.za/listing/tyger-valley-primary-school/,African Languages,Physical Sciences,Afrikaans,Visual Arts,Geography,7:00 am - 3:00 pm,"Tyger Valley College is an independent (private) school for boys & girls Gr 000-12 and is situated in the East of Pretoria. At Tyger Valley College, our aim is to provide education for the child in totality, and we do this within a spiritual, social, intellectual and physical milieu. In addition, we strive towards the development of the community and the College as an integral whole and part of that community. We create a sound educational institution where each and every pupil can develop to their full potential, equipped with an unshakeable relationship with his/her creator, a positive self-image and values such as love, respect, honesty, loyalty, self-discipline, humility, kindness and perseverance. We enable each child to enter into and engage with life as an independent and useful human being. See Silver Lakes area on map to see other schools nearby.Arthur Road & Graham Road Shere, Pretoria, 0054, South AfricaMonday7:00 am - 3:00 pmTuesday7:00 am - 3:00 pmWednesday7:00 am - 3:00 pmThursday7:00 am - 3:00 pmFriday7:00 am - 3:00 pmSaturdayClosedSundayClosed
							November 11, 2024 8:52 am local time","Arthur Road & Graham Road Shere, Pretoria, 0054, South Africa"
Gauteng,Randburg,hscott@trinityhouse.co.za,,,https://saprivateschools.co.za/listing/trinityhouse-randpark-ridge-pre-school/,CAPS,,Gauteng,Grade RR,Grade R,7:00 am - 3:00 pm,"Trinityhouse Schools seek to retain a pure and holistic approach to the essentials for daily life and education. The abiding fundamentals of education for each learner is formed through our solid Christian character and traditions. With your child as the victor and Trinityhouse as the faith-directed underpinning for academic and spiritual growth, we will set the path to a stimulating, independent, guidance driven environment. Our academia is specialised and controlled and our interactive and innovative aptitude can assure you of our leadership and team management. Trinityhouse Schools offer you, as the parent, a society that guarantees a sustaining way of life for your child. With a nurturing, truthful and committed community to our beliefs, our faculty will become your teacher and mentor. Our teacher-child relationship offers encouragement, commitment and confidence. Your child will become self assured, focused and have a quality Christian education.23 Knoppiesdoring St, Randpark Ridge, Randburg, 2169, South AfricaMonday7:00 am - 3:00 pmTuesday7:00 am - 3:00 pmWednesday7:00 am - 3:00 pmThursday7:00 am - 3:00 pmFriday7:00 am - 3:00 pmSaturdayClosedSundayClosed
							November 11, 2024 8:52 am local time","23 Knoppiesdoring St, Randpark Ridge, Randburg, 2169, South Africa"
Gauteng,Sandton,mel@littlecreations.co.za,,,https://saprivateschools.co.za/listing/infinity-primary-school/,Electrical Technology,Hospitality Studies,Mechanical Technology,Mathematics,Accounting,7:00 am - 3:00 pm,"Infinity College is an English medium, co-educational school based in the heart of Bryanston, Johannesburg. We strive to nurture our pupils with a love for learning. Each pupil is regarded as a unique individual and we strive to develop his or her potential to the fullest. Our pupils are stimulated to regard learning as a lifelong pursuit. As a school, our aim is to provide our pupils with the necessary skills and personal qualities needed to reach their full potential. The development of self-confidence and self-esteem is of crucial importance. We believe that our pupils need to be extended and challenged to expand and to grow as individuals. Our pupils are taught to think creatively and critically, to analyse and explore situations, to arrive at informed opinions and to continually expand their own horizons. Pupils are challenged to fulfil their academic potential. We have a passionate team of teachers who believe in the potential of every pupil. The teachers are trained and committed to an enriched, holistic and child-focused education. High moral standards prevail through encouragement of integrity, mutual respect, honesty, trust and self-discipline. 8 Curzon Rd, Bryanston, Sandton, 2191, South Africa, South AfricaMonday7:00 am - 3:00 pmTuesday7:00 am - 3:00 pmWednesday7:00 am - 3:00 pmThursday7:00 am - 3:00 pmFriday7:00 am - 3:00 pmSaturdayClosedSundayClosed
							November 11, 2024 8:52 am local time","8 Curzon Rd, Bryanston, Sandton, 2191, South Africa, South Africa"
Gauteng,Randburg,info@oceansprivateschool.co.za,,,https://saprivateschools.co.za/listing/oceans-private-primary-school/,Agricultural technology,Dance Studies,Civil Technology,Hospitality Studies,Mechanical Technology,7:00 am - 3:00 pm,"A place to learn and grow together It is the school's vision that each learner leaving Oceans Private School will leave with a sound academic foundation, will have participated actively in various spheres of the school, will have learnt morals, respect and represent all that is noble and good within the community of Randburg and everywhere we have other schools. Each learner will wear their uniform with pride and upon leaving the school their achievements will enable us to wish them well for their bright futures. Education at Oceans Private School is about self confidence, challenge and enjoyment. It teaches the importance of constructive questioning and a sense of responsibility with compassion, confidence and creativity. See Randburg SchoolsOceans Private School, Oak Avenue, Ferndale, Randburg, South Africa, South AfricaMonday7:00 am - 3:00 pmTuesday7:00 am - 3:00 pmWednesday7:00 am - 3:00 pmThursday7:00 am - 3:00 pmFriday7:00 am - 3:00 pmSaturdayClosedSundayClosed
							November 11, 2024 8:52 am local time","Oceans Private School, Oak Avenue, Ferndale, Randburg, South Africa, South Africa"
Western Cape,Cape Town,admin@herzlia.com,,,https://saprivateschools.co.za/listing/herzlia-high-school/,CAPS,,Western Cape,Facebook,Twitter,7:00 am - 3:00 pm,"This school's description is currently being updated and will appear within the near future.Deerpark Dr E, Vredehoek, Cape Town, 8001, South AfricaMonday7:00 am - 3:00 pmTuesday7:00 am - 3:00 pmWednesday7:00 am - 3:00 pmThursday7:00 am - 3:00 pmFriday7:00 am - 3:00 pmSaturdayClosedSundayClosed
							November 11, 2024 8:52 am local time","Deerpark Dr E, Vredehoek, Cape Town, 8001, South Africa"
Gauteng,Sandton,Magaliessig@nurtureandnature.co.za,,,https://saprivateschools.co.za/listing/nurture-and-nature-montessori-magaliesig-pre-school/,CAPS,,Gauteng,Grade RR,Grade R,7:00 am - 3:00 pm,"Magaliesig Nurture and Nature Montessori pre-school provides an integrated, inclusive, highly personalised educational environment for children from 18 months to 5 years old. Individual classes are specially designed to meet the developmental needs of the age range they serve. Nurture and Nature is recognised by the South African Montessori Association. We invite you to explore, learn and discover what we have to offer. At Nurture and Nature Montessori Preschool, we use a blend of Traditional and Montessori principles, to reveal each child's innate love of learning and prepare our children to thrive in a complex world. Nurture and Nature Montessori School was founded in 2007 to foster a love of learning and to educate children to be caring, socially responsible citizens of their community and world. The educational and supplemental programs at Nurture and Nature Montessori involve children from eighteen months through to five years old in two different programs: Toddler and Pre-school. Nurture and Nature Montessori School seeks to educate the whole child, applying the Montessori philosophy, in a family-oriented environment.Nurture and Nature Montessori Preschool - Magaliessig, Troupant Avenue, Magaliessig, Johannesburg, South Africa, South AfricaMonday7:00 am - 3:00 pmTuesday7:00 am - 3:00 pmWednesday7:00 am - 3:00 pmThursday7:00 am - 3:00 pmFriday7:00 am - 3:00 pmSaturdayClosedSundayClosed
							November 11, 2024 8:52 am local time","Nurture and Nature Montessori Preschool - Magaliessig, Troupant Avenue, Magaliessig, Johannesburg, South Africa, South Africa"
Gauteng,Randburg,randburg@taalct.co.za,,,https://saprivateschools.co.za/listing/taal-net-st-johns-high-school/,IEB,,Gauteng,Facebook,Twitter,7:00 am - 3:00 pm,"From Grade R â€“ 9 we follow the international curriculum (Cambridge) to create a strong foundation and from Grade 10 to 12 students have a chance to choice either Cambridge curriculum or Caps curriculum. 384 Kent Ave, Ferndale, Randburg, 2000, South AfricaMonday7:00 am - 3:00 pmTuesday7:00 am - 3:00 pmWednesday7:00 am - 3:00 pmThursday7:00 am - 3:00 pmFriday7:00 am - 3:00 pmSaturdayClosedSundayClosed
							November 11, 2024 8:52 am local time","384 Kent Ave, Ferndale, Randburg, 2000, South Africa"
Eastern Cape,East London,info@mpsc.co.za,,,https://saprivateschools.co.za/listing/merrifield-prep-primary-school-and-primary-school/,Religion Studies,Business Studies,Tourism,History,Agricultural Sciences,7:00 am - 3:00 pm,"Merrifield Preparatory School and College is a vibrant, dynamic school that continues to entrench its credentials and reputation year on year. Merrifield is defined firstly by its commitment to academics in offering a rigorous learning environment based on quality education. The school has established itself as the leading independent provider of pre-primary, preparatory and secondary education in the Buffalo City region. Based on small classes, personal attention, passion for teaching and learning, and a quality IEB curriculum, the academic focus at Merrifield is no doubt the source of the school's success as a thriving educational community. In addition, Merrifield is characterized by the holistic objective of nurturing well-rounded, balanced and socially-conscious students. Through a co-curricular programme across a diverse range of activities in community engagement, sport, culture and the environment, the school encourages the personal growth and overall development of each of our students. Not only are our students inspired to foster attitudes of individual curiosity, personal creativity and an entrepreneurial spirit, but more widely they are encouraged to cultivate a social conscience, values of compassionate and tolerant leadership, and the ideals of responsible, democratic citizenship. ? See East London area on map to see other schools nearby. Merrifield Preparatory School And College, N6, East London, South Africa, South AfricaMonday7:00 am - 3:00 pmTuesday7:00 am - 3:00 pmWednesday7:00 am - 3:00 pmThursday7:00 am - 3:00 pmFriday7:00 am - 3:00 pmSaturdayClosedSundayClosed
							November 11, 2024 8:52 am local time","Merrifield Preparatory School And College, N6, East London, South Africa, South Africa"
Gauteng,Randburg,admin@brightbeginningsschool.co.za,,,https://saprivateschools.co.za/listing/bright-beginnings-pre-school-randburg/,IEB,,Gauteng,Grade RR,Grade R,7:00 am - 3:00 pm,"Bright Beginnings Preschool ensures to offer a high standard of childcare, education and learning. We strive for Inclusive Education, focusing on the individual child holistically. It is our aim to incorporate international standards and to provide your child with the nurture, growth and learning that is imperative. A loving and caring environment that allows your child to learn through fun activities and play and reach his/her full potential. Our preschool provides qualified staff that are passionate, enthusiastic and loving. See Randburg Schools 112 Church St, Johannesburg North, Randburg, 2188, South AfricaMonday7:00 am - 3:00 pmTuesday7:00 am - 3:00 pmWednesday7:00 am - 3:00 pmThursday7:00 am - 3:00 pmFriday7:00 am - 3:00 pmSaturdayClosedSundayClosed
							November 11, 2024 8:52 am local time","112 Church St, Johannesburg North, Randburg, 2188, South Africa"
Gauteng,Midrand,info@dreamhillschools.co.za,,,https://saprivateschools.co.za/listing/dreamhill-international-primary-school/,Agricultural Management Practices,History,Agricultural Sciences,Dramatic Arts,Computer Applications Technology (CAT),7:00 am - 3:00 pm,"Welcome to DreamHill International School, an independent private school, to be affiliated with Cambridge University and recognised with Gauteng Department of Education. DreamHill School's curriculum will be a mix of Cambridge and CAPS to ensure a stable curriculum in par with the best international schools. Our mission is to promote high quality education to support young learners in their physical, mental and intellectual development that they may play constructive roles in society, with a strong focus on the intuitive skills that every child obtains.78 Lourens St, Halfway House, Midrand, 1685, South AfricaMonday7:00 am - 3:00 pmTuesday7:00 am - 3:00 pmWednesday7:00 am - 3:00 pmThursday7:00 am - 3:00 pmFriday7:00 am - 3:00 pmSaturdayClosedSundayClosed
							November 11, 2024 8:52 am local time","78 Lourens St, Halfway House, Midrand, 1685, South Africa"
Gauteng,Sandton,cmakaleng@advtech.co.za,,,https://saprivateschools.co.za/listing/crawford-preparatory-lonehill/,Mechanical Technology,Information Technology,English,Music,African Languages,7:00 am - 3:00 pm,"We provide students with access to our internationally renowned educational offering as Crawford International Lonehill is an authorised International Baccalaureate World School offering the Primary Years Programme (PYP).The International Baccalaureate Primary Years Programme offers students further opportunities to become active, caring, lifelong learners who are able to demonstrate respect for themselves and others while developing the capacity to confidently participate in the world. Sceales Road, Lonehill, South AfricaMonday7:00 am - 3:00 pmTuesday7:00 am - 3:00 pmWednesday7:00 am - 3:00 pmThursday7:00 am - 3:00 pmFriday7:00 am - 3:00 pmSaturdayClosedSundayClosed
							November 11, 2024 8:52 am local time","Sceales Road, Lonehill, South Africa"
Mpumalanga,White River,admin@thekingsschoolwr.co.za,,,https://saprivateschools.co.za/listing/the-kings-high-school-white-river/,CAPS,,Mpumalanga,Instagram,YouTube,7:00 am - 3:00 pm,"The King's School White River was started at Africa School of Missions in 1987, but changed hands in 2014 to make way for new owners and a brand new dynamic management team. We host Students from Grade 00 (three to four-year-olds) up to Grade 11 and in 2016 we will have our first Grade 12 group. We strive to offer well-rounded academic training whilst instilling solid principles for studying and thereby achieving better results. We have an openly Christian agenda and endeavour to help learners towards accepting The Lord Jesus as their Saviour and towards making Christian choices that would stand them in good stead for their whole lives. ""...no other name has been given , whereby man will be saved."" (Acts 4:12)21 Khumalo Dr, White River, 1240, South AfricaMonday7:00 am - 3:00 pmTuesday7:00 am - 3:00 pmWednesday7:00 am - 3:00 pmThursday7:00 am - 3:00 pmFriday7:00 am - 3:00 pmSaturdayClosedSundayClosed
							November 11, 2024 8:52 am local time","21 Khumalo Dr, White River, 1240, South Africa"
Cape Town,Constantia,admin@herzlia.com,,,https://saprivateschools.co.za/listing/herzlia-kerem-pre-pre-school/,CAPS,,Cape Town,Grade RR,Grade R,7:00 am - 3:00 pm,"Herzlia Kerem caters for children from playgroup (two years old) to Grade R and is a feeder school for Herzlia Constantia, which is situated on the same premises in the Southern Suburbs. The principal of Herzlia Kerem is Mrs Andrea Milwidsky. 16 Oak Farm Cres, The Vines, Cape Town, 7806, South AfricaMonday7:00 am - 3:00 pmTuesday7:00 am - 3:00 pmWednesday7:00 am - 3:00 pmThursday7:00 am - 3:00 pmFriday7:00 am - 3:00 pmSaturdayClosedSundayClosed
							November 11, 2024 8:52 am local time","16 Oak Farm Cres, The Vines, Cape Town, 7806, South Africa"
Gauteng,Sandton,admissions@brescia.co.za,+27 (0)11 706 7404,https://www.brescia.co.za/,https://saprivateschools.co.za/listing/brescia-house-primary-school/,English,Hospitality Studies,Information Technology,Physical Sciences,Religion Studies,7:00 am - 3:00 pm,"Brescia House School is an independent Catholic girls' school situated in the heart of Bryanston. Established in 1966 with only 196 learners, Brescia House School is one of South Africa's leading girls' schools. Over time, the school has developed an excellent reputation for the development of outstanding young girls who, benefiting from a well-rounded and balanced education, are able to make a meaningful contribution to society.14 Sloane St, Bryanston, Sandton, 2191, South AfricaMonday7:00 am - 3:00 pmTuesday7:00 am - 3:00 pmWednesday7:00 am - 3:00 pmThursday7:00 am - 3:00 pmFriday7:00 am - 3:00 pmSaturdayClosedSundayClosed
							November 11, 2024 8:52 am local time","14 Sloane St, Bryanston, Sandton, 2191, South Africa"
Gauteng,Jhb East,motsabim@stbenedicts.co.za,114 551 906,https://www.stbenedicts.co.za/,https://saprivateschools.co.za/listing/st-benedicts-boys-high-school-gauteng/,All Boys,English,CAPS,Grade RR,Grade R,7:00 am - 3:00 pm,"Welcome to St Benedict's and thank you for your interest in our school. St Benedict's is an independent Catholic school for boys that seeks to develop holistic, well-educated young men. Your Son Needs a Boys' School At St Benedict's we understand what makes boys tick. We keep boys active with learning, sports and the arts. We nurture their minds; shape their souls; build their bodies and hone their hearts. Developing men We are committed to helping all our boys develop into men who are competent, confident and compassionate. Their moral and spiritual development is as important as their academic results. Our boys learn to be independent yet interconnected. We instil strong values in our boys - and our pursuit of eight maturities - spiritual, moral, personal, academic, social, economic, physical and constitutional - underpins everything we do. Their holistic development is encouraged and celebrated. Watch them grow with pride We delight in boys moving with consummate ease from the rugby field or rowing boat to singing in the choir to focusing on their academic studies. We support their striving for excellence as we nourish their understanding of wider social and community engagement.Harcus Rd, Bedfordview, Germiston, 2008, South AfricaMonday7:00 am - 3:00 pmTuesday7:00 am - 3:00 pmWednesday7:00 am - 3:00 pmThursday7:00 am - 3:00 pmFriday7:00 am - 3:00 pmSaturdayClosedSundayClosed
							November 11, 2024 8:52 am local time","Harcus Rd, Bedfordview, Germiston, 2008, South Africa"
Kwazulu Natal,Northdene,admin@excelacademyofeducation.co.za,,,https://saprivateschools.co.za/listing/excel-academy-of-education-primary-school/,Mathematical Literacy,Mathematics,Accounting,Religion Studies,Business Studies,7:00 am - 3:00 pm,"Excel Academy of Education is An independent co-educational school situated in a quiet and tranquil suburb of Queensburgh, Durban. Excel Academy of Education is a child-centred school, boasting small classes (no more than 15 pupils per class) with more one-on-one time, from our dedicated and caring teachers and the teacher aides. Excel Academy offers a warm family environment and strives to nurture the unique gifts and abilities of each pupil. Weekly lessons by a registered occupational therapist focus on emotional intelligence, as well as fine and gross motor skills. Aftercare facilities are provided, these include; supervised homework, snacks as well as supervised play time. Transport can also be arranged. 18 Parkers Hill, road, Queensburgh, 4093, South AfricaMonday7:00 am - 3:00 pmTuesday7:00 am - 3:00 pmWednesday7:00 am - 3:00 pmThursday7:00 am - 3:00 pmFriday7:00 am - 3:00 pmSaturdayClosedSundayClosed
							November 11, 2024 8:52 am local time","18 Parkers Hill, road, Queensburgh, 4093, South Africa"
Kwazulu Natal,Durban,theprep@stmartinprep.co.za,,,https://saprivateschools.co.za/listing/st-martins-pre-primary-school/,Tourism,Economics,Visual Arts,Consumer Studies,Agricultural technology,7:00 am - 3:00 pm,"St Martin's Pre-Primary is a busy, happy place and this necessitates everyone knowing exactly what is happening, when and where! We pride ourselves on our communication... (And we keep in touch through the School Notebooks, in Newsletters, with the webpage, using the SMS 'Phone Around, posting notices on the Did You Know Board and on blackboards in the Patio Area and via email, as well in personal interaction). 12 Chelsea Dr, Durban North, 4051, South AfricaMonday7:00 am - 3:00 pmTuesday7:00 am - 3:00 pmWednesday7:00 am - 3:00 pmThursday7:00 am - 3:00 pmFriday7:00 am - 3:00 pmSaturdayClosedSundayClosed
							November 11, 2024 8:52 am local time","12 Chelsea Dr, Durban North, 4051, South Africa"
Gauteng,Midrand,info@kepp.co.za,,,https://saprivateschools.co.za/listing/kyalami-estates-pre-primary/,CAPS,,Gauteng,Grade RR,Grade R,7:00 am - 3:00 pm,"Kyalami Estates Pre-Primary (KEPP) is a well-established and highly reputable Pre-Primary School situated within the secure Kyalami Estates. KEPP has been providing quality education since 2001. We provide a step-by-step, milestone-based programme that includes a variety of exciting activities which combine to deliver developmental stimulation as well as a fun environment in which to play and learn. These structured daily activities nurture an enquiring mind in preparation for Primary School. Kyalami Estates Pre-Primary cater for children living in and out of Kyalami Estates. Our diverse cultures form the KEPP family. We accept children from 3 months old to 5 years old. KEPP is designed to make your child feel at home, confident and comfortable in his/her own ability to explore and learn. Duck and girl Our interior spaces have been colour-coded and scaled to accommodate your child's needs; from personal lockers to child-height toilets and basins. Our playgrounds are well equipped and are age-appropriate for your child's requirements; with sturdy wooden jungle gyms, sandpits, bike tracks and a trampoline. We offer extended hours: we open from 6:30am to 6:00pm, with a variety of collection times in between to accommodate your personal needs. KUHL MONTESSORI SCHOOL, Thabo Mbeki Street, Polokwane Central, Polokwane, South Africa, South AfricaMonday7:00 am - 3:00 pmTuesday7:00 am - 3:00 pmWednesday7:00 am - 3:00 pmThursday7:00 am - 3:00 pmFriday7:00 am - 3:00 pmSaturdayClosedSundayClosed
							November 11, 2024 8:53 am local time","KUHL MONTESSORI SCHOOL, Thabo Mbeki Street, Polokwane Central, Polokwane, South Africa, South Africa"
Annlin,Gauteng,littlecamelot@educatingthenation.com,,,https://saprivateschools.co.za/listing/little-camelot-nursery-pre-school/,CAPS,,Annlin,Grade RR,Grade R,7:00 am - 3:00 pm,"Looking for a fun, energetic, whole child program for you child? Little Camelot is the school for you. We believe in educating our little ones with the best care and attention possible. Our program offers learning through facilitated play to ensure each milestone your child needs to reach before formal schooling is accomplished. Our teachers are committed to your child's progress and therefore we also offer continuous assessment in order to monitor your child as they prepare for the big day! Ã¯Â»Â¿ Ã¯Â»Â¿From the morning until home time we allow create opportunities to grow socially, physically, emotionally, and cognitively. Our program also covers complete skills development so you can rest assure that your child is growing inside and out everyday! We offer full-day and half-day programs. Our class ages range from 12 months up and until 5 years. We only allow 15 children in a class in order for us to each child the best attention they deserve. Ã¯Â»Â¿Child Learning Focus: Learning through facilitated play is our priority! Our children are allowed to progress at their own pace and are given the opportunity to take responsibility for their own learning and work.Little Camelot Nursery School, Chervil Avenue, Annlin, Pretoria, South Africa, South AfricaMonday7:00 am - 3:00 pmTuesday7:00 am - 3:00 pmWednesday7:00 am - 3:00 pmThursday7:00 am - 3:00 pmFriday7:00 am - 3:00 pmSaturdayClosedSundayClosed
							November 11, 2024 8:53 am local time","Little Camelot Nursery School, Chervil Avenue, Annlin, Pretoria, South Africa, South Africa"
Gauteng,Pretoria East,info@thekindergarten.co.za,,,https://saprivateschools.co.za/listing/the-kindergarten-at-rosemary-hill-pre-school/,IEB,,Gauteng,Grade RR,Grade R,7:00 am - 3:00 pm,"The Kindergarten is a nursery school based on the Waldorf educational system, set in the beautiful surrounds of Rosemary Hill Farm, a 200 hectare working farm in the east of Pretoria. When you walk through the doors of The Kindergarten you cannot help but be transported back to the land of imagination and imitation; of elves and fairies, princes and princesses, castles and knights and anything and everything the mind can conjure up. You immediately become aware of the warm, homely environment: a sanctuary in which the children can feel both comfortable and safe whilst exploring the world around them. Daily rhythm and repetition play a vital role in making children feel safe and boosts self-confidence. This rhythm and repetition forms the basis of our curriculum. A gentle and consistent flowing daily and weekly routine is observed. Seasonal celebrations help them follow Mother Nature's rhythms.Plot 257, Mooiplaats, Pretoria, 0001, South AfricaMonday7:00 am - 3:00 pmTuesday7:00 am - 3:00 pmWednesday7:00 am - 3:00 pmThursday7:00 am - 3:00 pmFriday7:00 am - 3:00 pmSaturdayClosedSundayClosed
							November 11, 2024 8:53 am local time","Plot 257, Mooiplaats, Pretoria, 0001, South Africa"
