Province,Town,Email,Phone,Website,Website1,Gender,Language,Curriculum,GradeMin,GradeMax,OpeningHours,Description,Address
Western Cape,Plettenberg Bay,admin@plettcs.co.za,,,https://saprivateschools.co.za/listing/plettenberg-bay-christian-high-school/,Ball Skills,Chess,Cross-Country,Drama,Christian,7:45 am - 2:30 pm,"At the Plettenberg Bay Christian School, we encourage character-building and individualized, mastery learning. Diagnostic testing assures that every student finds their place of learning at a level of individual performance.
Our vision is to become a College of Christian Education from pre-school to post-school developing Godly character in tomorrow's leaders.
Our mission: Developing responsible life-long learners of Character to positively impact communities with a Biblical worldview. We believe now more than ever that the individualized learning methodology of ACE (which has stood the test of time) is indeed an effective tool in equipping students to fulfil their calling. Our students have received great reports from both universities and the professional domain and we are delighted at their successes.N2 West, Hill View (towards Knysna, opposite Kwanokuthula), Plettenberg Bay, 6600Monday7:45 am - 2:30 pmTuesday7:45 am - 2:30 pmWednesday7:45 am - 2:30 pmThursday7:45 am - 2:30 pmFriday7:45 am - 2:30 pmSaturdayClosedSundayClosed
							November 11, 2024 9:48 am local time","N2 West, Hill View (towards Knysna, opposite Kwanokuthula), Plettenberg Bay, 6600"
Gauteng,Johannesburg,shaida@sparrowportal.co.za,,,https://saprivateschools.co.za/listing/sparrows-combined-technical-skills-primary-school/,Religion Studies,Business Studies,Tourism,History,Agricultural Sciences,7:00 am - 3:00 pm,"We're a non-profit, non-government organisation which strives to provide young, disadvantaged South Africans, with cognitive barriers to learning, the opportunity to access quality and accredited education. We ensure that what we offer remains affordable, while always imbued with the core principles of sound educational practice. Cnr Gerty &, Hermans St, Sophia Town, Johannesburg, 2092, South AfricaMonday7:00 am - 3:00 pmTuesday7:00 am - 3:00 pmWednesday7:00 am - 3:00 pmThursday7:00 am - 3:00 pmFriday7:00 am - 3:00 pmSaturdayClosedSundayClosed
							November 11, 2024 9:48 am local time","Cnr Gerty &, Hermans St, Sophia Town, Johannesburg, 2092, South Africa"
Gauteng,Randburg,lindaco@iburst.co.za,https://samontessori.org.za/,,https://saprivateschools.co.za/listing/craighall-college-independent-pre-school/,English,CAPS,,Risidale,Grade RR,7:00 am - 3:00 pm,"Craighall College is an Independent School registered with the Department of Education. We are functioning as a private school since 2006. Craighall College has a team of professionals that can help a child to learn, develop and excel! We believe in individualism. Every child was born uniquely and with his or her own individual needs and capabilities. Here at Craighall College our team of professionals aim to meet the intellectual needs of our students. The small groups create an intimate environment for children so they may receive more individualized attention. This school ensure that learners are given the opportunity to optimize their vast potential in a Christian environment. See Randburg area on map to see other schools nearby.210 Danie Cres, Risidale, Randburg, 2195, South AfricaMonday7:00 am - 3:00 pmTuesday7:00 am - 3:00 pmWednesday7:00 am - 3:00 pmThursday7:00 am - 3:00 pmFriday7:00 am - 3:00 pmSaturdayClosedSundayClosed
							November 11, 2024 9:48 am local time","210 Danie Cres, Risidale, Randburg, 2195, South Africa"
Western Cape,Oudtshoorn,admin@principiaprimary.co.za,,,https://saprivateschools.co.za/listing/principia-independent-pre-school/,CAPS,,Western Cape,Facebook,Twitter,7:00 am - 3:00 pm,"Principia Primary School is a proudly independent, co-educational parallel medium school situated in the heart of the Little Karoo, in Oudtshoorn. Principia Primary opened its doors in January 2011 and grew out of the former Principia College when a group of parents felt there was a need in Oudtshoorn for a dual medium, independent school that could provide a progressive approach to primary education, presented by well qualified, experienced teachers in a loving and caring, secure environment. At the moment we cater for Grades RR - 7. Principia Primary School is run by a dedicated Steering Committe consisiting of parents, educators and professionals from within the school as well as from the broader community.Principia Independent School, Jan Van Riebeeck Road, Oudtshoorn, South Africa, South AfricaMonday7:00 am - 3:00 pmTuesday7:00 am - 3:00 pmWednesday7:00 am - 3:00 pmThursday7:00 am - 3:00 pmFriday7:00 am - 3:00 pmSaturdayClosedSundayClosed
							November 11, 2024 9:48 am local time","Principia Independent School, Jan Van Riebeeck Road, Oudtshoorn, South Africa, South Africa"
Gauteng,Midrand,admin@carlswaldhouse.co.za,,,https://saprivateschools.co.za/listing/carlswald-house-preparatory-school/,English,Life Sciences,Mathematical Literacy,Physical Sciences,Afrikaans,7:00 am - 3:00 pm,"Welcome to every child's cloud nine! At 345 we strive to educate our children in a safe, secure and fun-loving environment - a support structure that will provide your children with maximum learning experiences. Children need a relationship of trust and understanding with their teachers in order to feel safe and secure and we provide this foundation for effective education. Teaching is not our profession, it's our passion. At 345 our playground is completely secure and well equipped with a wide range of SAFE jungle gyms and other play equipment, the children are also supervised at all times during outside play. Sand and water is also made available for the children at playtime. ? See Midrand area on map to see other schools nearby.82 Lyncon Rd, Carlswald, Midrand, 1684, South Africa82 Lyncon Rd, Carlswald, Midrand, 1684, South AfricaMonday7:00 am - 3:00 pmTuesday7:00 am - 3:00 pmWednesday7:00 am - 3:00 pmThursday7:00 am - 3:00 pmFriday7:00 am - 3:00 pmSaturdayClosedSundayClosed
							November 11, 2024 9:48 am local time","82 Lyncon Rd, Carlswald, Midrand, 1684, South Africa"
Arcadia,Gauteng,lsteinbrucker@aisj-jhb.com,,,https://saprivateschools.co.za/listing/american-international-primary-school-johannesburg/,Accounting,Music,African Languages,Tourism,Economics,7:00 am - 3:00 pm,"As South Africa continues to attract foreign companies and diplomatic missions, AISJ's growth will be directly connected with South Africa's renaissance. Our diverse student population today stands at approximately 107 nationalities school-wide and AISJ provides an atmosphere in which students can maximize the academic potential in a safe and encouraging environment. To maintain the school's strong tradition of providing an excellent balanced program, while attracting new students, AISJ will have to continue growing, and the school's Facilities Master Plans foresees a Johannesburg campus that can accommodate 1050 students, and a Pretoria Campus that can accommodate 300 students. In short, the school is well positioned to accommodate projected growth. For school fees and other admissions information, please contact us below by emailing or completing the form at the bottom of this page:Scorpion Trail St, Knopjeslaagte, Midrand, 1682, South AfricaScorpion Trail St, Knopjeslaagte, Midrand, 1682, South AfricaMonday7:00 am - 3:00 pmTuesday7:00 am - 3:00 pmWednesday7:00 am - 3:00 pmThursday7:00 am - 3:00 pmFriday7:00 am - 3:00 pmSaturdayClosedSundayClosed
							November 11, 2024 9:48 am local time","Scorpion Trail St, Knopjeslaagte, Midrand, 1682, South Africa"
Bedelia,Free State,school@sasw.co.za,,,https://saprivateschools.co.za/listing/st-andrews-primary-school-welkom/,Visual Arts,Geography,Agricultural Management Practices,Dance Studies,Civil Technology,7:00 am - 3:00 pm,"St Andrew's School is a religious school, founded on an Anglican ethos. We are inspired by our faith in God, and are a people of hope, imagination and commitment. St Andrew's School is a place of learning where acceptance and belonging prevails. We value the unique richness of every individual member of the school community. In a dynamic and stimulating environment, we provide an education of body, mind and spirit. We educate for life. We help young people to become happy, confident and competent people of hope and personal integrity, with a deep sense of justice and compassion, and with this a sense of social responsibility to transform the world around them. If you have specific interest in this school,Corner of Hamlet Road and St Andrew""s Way, Bedelia, Welkom, 9459, South AfricaMonday7:00 am - 3:00 pmTuesday7:00 am - 3:00 pmWednesday7:00 am - 3:00 pmThursday7:00 am - 3:00 pmFriday7:00 am - 3:00 pmSaturdayClosedSundayClosed
							November 11, 2024 9:48 am local time","Corner of Hamlet Road and St Andrew""s Way, Bedelia, Welkom, 9459, South Africa"
Atlantic Seaboard,Western Cape,admin@elfmontessori.co.za,,,https://saprivateschools.co.za/listing/sea-point-montessori-pre-school/,CAPS,,Atlantic Seaboard,Grade RR,Grade R,7:00 am - 3:00 pm,"This school's description is currently being updated and will appear within the near future.82 Kloof Rd, Sea Point, Cape Town, 8060, South AfricaMonday7:00 am - 3:00 pmTuesday7:00 am - 3:00 pmWednesday7:00 am - 3:00 pmThursday7:00 am - 3:00 pmFriday7:00 am - 3:00 pmSaturdayClosedSundayClosed
							November 11, 2024 9:48 am local time","82 Kloof Rd, Sea Point, Cape Town, 8060, South Africa"
,,info@willowacademy.co.za,,,https://saprivateschools.co.za/listing/willow-academy-primary-school/,Tourism,Economics,Visual Arts,Consumer Studies,Agricultural technology,7:00 am - 3:00 pm,"Our Pre-Primary school is situated on the premises of Willow Academy. We have two classes- the Giraffes and the Lions which cater for Grade 0 and Grade R. We pride ourselves in providing a wide variety of activities and a strong Bible-based curriculum. We teach our children to love and respect God, their neighbours and themselves. We believe that training children to have faith in God from a young age plays a vital role in their life. In our Primary School we have a well rounded education program incorporating Government approved CAPS and a Beka Christian text books. In all our grades we teach from a Christian worldview perspective and maintain strong Christian values. Our small classes enable learners to reach their maximum potential. From Grade 1-3 we encourage our learners to memorise scriptures and poems as part of their curriculum. The High School we mentor our learners, preparing them for their future and to be a light to the world. All our subjects are taught from a Christian perspective and with Christian values. Grade 12's write IEB examinations and since our first class matriculated in 2012, we have grown as a school with excellent academics results.Cedar Rd, Fairview, Gqeberha, 6070, South AfricaMonday7:00 am - 3:00 pmTuesday7:00 am - 3:00 pmWednesday7:00 am - 3:00 pmThursday7:00 am - 3:00 pmFriday7:00 am - 3:00 pmSaturdayClosedSundayClosed
							November 11, 2024 9:48 am local time","Cedar Rd, Fairview, Gqeberha, 6070, South Africa"
Germiston,Gauteng,justin@taalct.co.za,http://tbear.co.za/,,https://saprivateschools.co.za/listing/taal-net-germiston-pre-school/,English,CAPS,,Jhb East,Grade RR,7:00 am - 3:00 pm,"Study the Taal-Net way is the flexible, accessible way to brush up on your skills, advance your career and realize your dreams. Taal-Net International makes it easier for you. You will also have access to individual attention from qualified tutors and other support staff. ? ? See Germiston area on map to see other schools nearby.437 Sam Green Rd, Meadowdale, Germiston, Johannesburg, 1627, South AfricaMonday7:00 am - 3:00 pmTuesday7:00 am - 3:00 pmWednesday7:00 am - 3:00 pmThursday7:00 am - 3:00 pmFriday7:00 am - 3:00 pmSaturdayClosedSundayClosed
							November 11, 2024 9:48 am local time","437 Sam Green Rd, Meadowdale, Germiston, Johannesburg, 1627, South Africa"
Kwazulu Natal,Durban,kingsword.academy@yahoo.com,,,https://saprivateschools.co.za/listing/kingsword-academy-pre-school/,IEB,,Kwazulu Natal,Grade RR,Grade R,7:00 am - 3:00 pm,"Our Mission Statement To respect/accept and uniqueness and individuality of each Learner. To provide facilities and resources that will encourage the development of each Learner and enhance the quality of education as a whole. To involve our Learners in up-liftment programmes for the poor and needy. To promote good role models. To reward excellence. To foster the creative, critical and scholarly talents of our Learners. To promote the praise and worship of God and to promote moral and ethical values for lasting life change in order to produce mature, well-equipped Learners. To be recognized as a school of excellence. To produce Leaders and citizens of quality To uphold the dignity and respect of each Learner. To inform and equip our Learners to be proactive and effectively address ungodly agendas. ? Kingsword Academy, Lilac Road, Shallcross, Durban, South Africa, South AfricaMonday7:00 am - 3:00 pmTuesday7:00 am - 3:00 pmWednesday7:00 am - 3:00 pmThursday7:00 am - 3:00 pmFriday7:00 am - 3:00 pmSaturdayClosedSundayClosed
							November 11, 2024 9:48 am local time","Kingsword Academy, Lilac Road, Shallcross, Durban, South Africa, South Africa"
Western Cape,South Peninsula,info@littlestars.co.za,,,https://saprivateschools.co.za/listing/little-stars-montessori-pre-school/,CAPS,,Western Cape,Grade RR,Grade R,7:00 am - 3:00 pm,"Little stars Montessori is a small private Pre-school following the Montessori Method of teaching. We offer a small class and individual attention, which ensures that your child feels at home. Children in our school have the freedom to explore their environment and to pick and choose the things they want to play with and learn from which develops their independence. Our outdoor, nature focused environment is designed with children in mind and offers a variety of activities. Art, Music and Culture activities form part of each day at our school and we offer activities in this field as well. As we believe that only if parents and teachers work together in the education of their children will the optimum result be achieved, we encourage parent participation. Our Montessori class takes advantage of each child's unique sensitivities and offers exercises in language development, sensor motor development, reading, mathematics, physical and natural sciences, geography and cultural studies, music, art, drama and body movement.Little Stars Montessori, Klipper Crescent, Sun Valley, Cape Town, South Africa, South AfricaMonday7:00 am - 3:00 pmTuesday7:00 am - 3:00 pmWednesday7:00 am - 3:00 pmThursday7:00 am - 3:00 pmFriday7:00 am - 3:00 pmSaturdayClosedSundayClosed
							November 11, 2024 9:48 am local time","Little Stars Montessori, Klipper Crescent, Sun Valley, Cape Town, South Africa, South Africa"
Gauteng,Sandton,leanne@valbonnecollege.co.za,,,https://saprivateschools.co.za/listing/valbonne-primary-school/,Tourism,Economics,Visual Arts,Consumer Studies,Agricultural technology,7:00 am - 3:00 pm,"Nestled in the beautiful neighbourhood of Beverley Lonehill is the upcoming Valbonne College. A new intimate Primary school with French inspired architecture and landscaped gardens in a secure and quiet area. The private school couples an excellent academic system along with cultural and extra curriculum activities to ensure that we raise a well-rounded generation of children, with the highest levels of confidence, self-assurance and independence. When learners are ready to leave they will be confident in their own abilities, with skills to extend and apply their knowledge and the belief that learning is an enjoyable and rewarding experience. Valbonne College will be run by a team of highly committed teachers and support staff, working in partnership with governors and parents to provide the best possible education, laying down firm foundations for our learners' successful futures. ? See Lonehill area on map to see other schools nearby.0A Valbonne Dr, Beverley AH Valbonne Dr, Beverley AH, Sandton, 2191, South AfricaMonday7:00 am - 3:00 pmTuesday7:00 am - 3:00 pmWednesday7:00 am - 3:00 pmThursday7:00 am - 3:00 pmFriday7:00 am - 3:00 pmSaturdayClosedSundayClosed
							November 11, 2024 9:48 am local time","0A Valbonne Dr, Beverley AH Valbonne Dr, Beverley AH, Sandton, 2191, South Africa"
Gauteng,Pretoria Central,registrations@royalschools.co.za,+27 (0) 12 324 1069,https://www.royalschools.co.za/princess-park-private-schools-pretoria.html,https://saprivateschools.co.za/listing/royal-high-schools-princess-park/,Co-Ed (Mixed),English,CAPS,,Arcadia,7:00 am - 3:00 pm,"In 1993 the Fourie family started one of the first affordable private schools in South Africa. In many cases learners had limited opportunities to receive quality education. With an engrained passion for education, and the support of dedicated and loyal people, the Fouries have managed to establish and grow a successful organisation over the last 28 years.614 Pretorius St, Arcadia, Pretoria, 0001, South AfricaMonday7:00 am - 3:00 pmTuesday7:00 am - 3:00 pmWednesday7:00 am - 3:00 pmThursday7:00 am - 3:00 pmFriday7:00 am - 3:00 pmSaturdayClosedSundayClosed
							November 11, 2024 9:49 am local time","614 Pretorius St, Arcadia, Pretoria, 0001, South Africa"
Western Cape,George,info@glenwoodhouse.co.za,,,https://saprivateschools.co.za/listing/glenwood-house-pre-school/,CAPS,,Western Cape,Facebook,Twitter,7:00 am - 3:00 pm,"This school's description is currently being updated and will appear within the near future.1 Glenwood Ave, Glenwood AH, George, 6529, South AfricaMonday7:00 am - 3:00 pmTuesday7:00 am - 3:00 pmWednesday7:00 am - 3:00 pmThursday7:00 am - 3:00 pmFriday7:00 am - 3:00 pmSaturdayClosedSundayClosed
							November 11, 2024 9:49 am local time","1 Glenwood Ave, Glenwood AH, George, 6529, South Africa"
Bloemfontein,Free State,admin@kyriosschool.co.za,https://www.poplaracademy.co.za/,,https://saprivateschools.co.za/listing/kyrios-independent-primary-school/,Information Technology,English,Life Sciences,African Languages,Physical Sciences,7:00 am - 3:00 pm,"Kyrios Independent School was established in 2011 when the owners were faced with serious challenges with regards to their youngest son's schooling. As busy ""business owning"" parents who care deeply about their children, they needed to find the best possible solution. They decided to employ a teacher to home-school their son. This turned out to be a successful endeavour as their son's results and his attitude improved significantly. It became apparent that sometimes so called ""difficult or impossible"" kids who are often rejected by other institutions simply required more individual attention and adapted engagement methods that are not readily available in larger schools with high density classrooms. Soon there were requests from friends to join the home-schooling group, and as they realised that most of these kids were desperate, they allowed them to join. The result: for the 2011 school year the six matric pupils in the school all passed successfully. This is still the heart of Kyrios.Kyrios Independent School, Bloemfontein, South Africa, South AfricaMonday7:00 am - 3:00 pmTuesday7:00 am - 3:00 pmWednesday7:00 am - 3:00 pmThursday7:00 am - 3:00 pmFriday7:00 am - 3:00 pmSaturdayClosedSundayClosed
							November 11, 2024 9:49 am local time","Kyrios Independent School, Bloemfontein, South Africa, South Africa"
Auckland Park,Gauteng,primaryschool@mcauleyhouse.co.za,,,https://saprivateschools.co.za/listing/mcauley-house-primary-school/,IEB,,Auckland Park,Facebook,Twitter,7:00 am - 3:00 pm,"McAuley House is a Catholic independent day school which offers co-ed grade R - 7 and girls only Grade 8 to 12. 100% Matric pass and 100% Batchelor's pass in 2014. Our school is a Mercy School based on the person of Jesus Christ, where our love of God is celebrated as a school family. Priority is given to the living of Christian values and respect and kindness for all, especially those neglected by the world. each young person is encouraged to develop fully within an atmosphere of care, respect and joy. Our Vision The vision of our school is to produce strong, confident, compassionate women and young boys who will strive to serve the needs of the South African community and the world with dignity, humility and integrity. ? See Auckland Park area on map to see other schools nearby. McAuley House School, Sans Souci Road, Parktown, Johannesburg, South Africa, South AfricaMonday7:00 am - 3:00 pmTuesday7:00 am - 3:00 pmWednesday7:00 am - 3:00 pmThursday7:00 am - 3:00 pmFriday7:00 am - 3:00 pmSaturdayClosedSundayClosed
							November 11, 2024 9:49 am local time","McAuley House School, Sans Souci Road, Parktown, Johannesburg, South Africa, South Africa"
Alberton,Gauteng,registrations@royalschools.co.za,+27 (0) 12 324 1069,https://www.royalschools.co.za/sky-city-private-schools-johannesburg.html,https://saprivateschools.co.za/listing/royal-primary-school-sky-city/,Electrical Technology,Hospitality Studies,Mechanical Technology,Mathematics,Accounting,7:00 am - 3:00 pm,"In 1993 the Fourie family started one of the first affordable private schools in South Africa. In many cases learners had limited opportunities to receive quality education. With an engrained passion for education, and the support of dedicated and loyal people, the Fouries have managed to establish and grow a successful organisation over the last 28 years.corner Lemon Shark and Kingfish street Sky City Watervalspruit, 1724, South AfricaMonday7:00 am - 3:00 pmTuesday7:00 am - 3:00 pmWednesday7:00 am - 3:00 pmThursday7:00 am - 3:00 pmFriday7:00 am - 3:00 pmSaturdayClosedSundayClosed
							November 11, 2024 9:49 am local time","corner Lemon Shark and Kingfish street Sky City Watervalspruit, 1724, South Africa"
Gauteng,Jhb East,hrsprimary@holyrosaryschool.co.za,,,https://saprivateschools.co.za/listing/holy-rosary-high-school/,CAPS,,Gauteng,Facebook,Twitter,7:00 am - 3:00 pm,"Catholic Day School for Girls in Johannesburg Holy Rosary School is a Catholic Day School for Girls from Grade R through to Grade 12. The school is conveniently located in Edenvale, Johannesburg. It was founded by Bishop Shanahan and the Sisters of the Holy Rosary Order in 1940. While we are faithful to the teachings of the Catholic Church. Any girl is welcome at Holy Rosary and we welcome the enrichment provided by other cultures and religions. As parents you are looking for a warm and nurturing environment where the potential of your child will be encouraged and developed. You are looking for excellent teaching, good sports facilities and a wide range of cultural activities. Like any parent, you also want instilled in your child sound Gospel values and spiritual belief. This is what we promise you! We are proud of our Holy Rosary girls. They are a testimony to what you can expect from the Holy Rosary Family - young women of faith, integrity and courage. Contact us today and become part of our family. 113 Horwood St, Edenvale, Johannesburg, South Africa, South AfricaMonday7:00 am - 3:00 pmTuesday7:00 am - 3:00 pmWednesday7:00 am - 3:00 pmThursday7:00 am - 3:00 pmFriday7:00 am - 3:00 pmSaturdayClosedSundayClosed
							November 11, 2024 9:49 am local time","113 Horwood St, Edenvale, Johannesburg, South Africa, South Africa"
Gauteng,Florida,admin@archerscollege.co.za,,,https://saprivateschools.co.za/listing/archers-pre-school/,CAPS,,Gauteng,Grade RR,Grade R,7:00 am - 3:00 pm,"WE ARE NOT YOUR TRADITIONAL SCHOOLThis is a â€œhome away from home.â€ This is where your child will engage his or her 21st Century critical thinking and problem-solving skills. This is where your child will learn core values. It is here that your child enjoys every day learning experiences that will contribute to a life-long learning experience./  A Project and creativity based curriculum/  Partnerships that add to our everyday learning experience431 Ontdekkers Rd, Florida, Roodepoort, 1709, South AfricaMonday7:00 am - 3:00 pmTuesday7:00 am - 3:00 pmWednesday7:00 am - 3:00 pmThursday7:00 am - 3:00 pmFriday7:00 am - 3:00 pmSaturdayClosedSundayClosed
							November 11, 2024 9:49 am local time","431 Ontdekkers Rd, Florida, Roodepoort, 1709, South Africa"
Gauteng,Sandton,info@eduinc.co.za,http://luxcollege.org/,,https://saprivateschools.co.za/listing/education-incorporated-high-school/,English,IEB,,Fourways,Facebook,7:00 am - 3:00 pm,"Education Incorporated is a private boutique school with a unique perspective on education. Our select educators provide attentive and personalised teaching to very small groups of children with potential. We grow children into independent thought leaders able to succeed in whichever path they choose in life. Our global citizens come from all walks of life, but we have found that our demographics tend towards five distinct groups. Education Incorporated has exceptionally high academic standards with a solid support structure, and as such we attract students who want to achieve academically. ? See Fourways area on map to see other schools nearby. 40 Kingfisher Dr, Fourways, Johannesburg, 2055, South AfricaMonday7:00 am - 3:00 pmTuesday7:00 am - 3:00 pmWednesday7:00 am - 3:00 pmThursday7:00 am - 3:00 pmFriday7:00 am - 3:00 pmSaturdayClosedSundayClosed
							November 11, 2024 9:49 am local time","40 Kingfisher Dr, Fourways, Johannesburg, 2055, South Africa"
